Tweets,Follower
dream makers live liberty village story brand foot ceilings msg interested,dreamakerrealty
tridel speaking bildgta event,dreamakerrealty
deals tablenow big negotiators win outa lot players dealswho will best dealhmmmmm,dreamakerrealty
walkerlaw excited honoured black history month posterparliament hill congrats deserve,dreamakerrealty
creflodollar faith practical expression confidence god word,dreamakerrealty
jca housetalking justice educationemploymentetc feel blessed change community,dreamakerrealty
great morning session,dreamakerrealty
powerful hr convothx lord,dreamakerrealty
great read donrcampbell year confusion concern consternation perfect environment sophisticated investor ,dreamakerrealty
great time church hear don moen perform high expectations,dreamakerrealty
canadabusiness real estate bubble news,dreamakerrealty
kardinalo good half time raptors gamesome good ol tracks,dreamakerrealty
reason dmr big projects mimico danforth read torontolife mag,dreamakerrealty
big ike dreamteam setting shiatsu massage teammuch needed lol tridel condo xmas party,dreamakerrealty
learn join category joining,dreamakerrealty
dreammakerworking dream pad mississauga story padby dreamteam members fab,dreamakerrealty
told going hard till xmas big meeting day big week couple meetings senators pastors builders hard,dreamakerrealty
game joke project buy listed price started units left,dreamakerrealty
real estate market slowing tridel building nice storeys love itmsg details gonna nuts,dreamakerrealty
slf thankswelcome dream team againanother great addition team,dreamakerrealty
tjmos thanksi greatest team,dreamakerrealty
weekend big week aheadnew project launch very close stay tune details,dreamakerrealty
toronto board trade award nightsold outshould good nightwe award,dreamakerrealty
wow speechkevin williams president ceo gm canadadeep,dreamakerrealty
fingers crossedpossible office lakeshore moving control area bf city sees valuelove game,dreamakerrealty
long daymorning interview rogers tvevening investors presentation campaign dreamfundwealth creation real estate,dreamakerrealty
good game overallhardest guys cutthis pick upplay hard team,dreamakerrealty
game timebout hit stagedreamfund,dreamakerrealty
toronto list best example growth opportunity city,dreamakerrealty
long daybut thx godgood job marcel closing fund increased holdings couple millionsdreamfund,dreamakerrealty
long week donetiff launchlets,dreamakerrealty
promisednew development projectrrsp eligibleland security prime locationhigh returns msg isaacdreammakerrealtyca,dreamakerrealty
ready head national basketball league canada st draft rogers centre,dreamakerrealty
ufsc toronto mentoring session dream big route generational wealth with isaac olowolafe jr president ceo,dreamakerrealty
best start morning golfing sandy lane golf coursebarbados,dreamakerrealty
move levelthe big players test usdream team waiting time hard,dreamakerrealty
dream fund manager one meeting president largest institution canada management talk dream fund,dreamakerrealty
excellent meeting giftsscholarship director major universitydreamfund green light stay tune large university fund,dreamakerrealty
good ol restingjust time long weekwelcome team korea,dreamakerrealty
best residential commercial opportunities dreamfund big time investors msg action large land development deal asap,dreamakerrealty
closer closerpple starting arguegzzzz money,dreamakerrealty
big investment launch saturday prime real estate msg info,dreamakerrealty
live cagp acpdp conference,dreamakerrealty
awudrick journodale governor general law door woman represents,MacSweeneyG
gavmac ottawacitizen paddynotpatty,MacSweeneyG
rickanderson channel news sense trump how ppl follow,MacSweeneyG
nspector fail fulfill civic duty gripe choose sit hands,MacSweeneyG
laurapayton teach cat tricks,MacSweeneyG
robfordmancs ldobsonhughes philosopher leave social scientists interesting,MacSweeneyG
graciestyle represented half confederation dief dividing stretch,MacSweeneyG
graciestyle elevate argument national unity serves purpose finding solution,MacSweeneyG
stuartinthecage gavmac paoconnell laurapayton cmaconthehill heads life good,MacSweeneyG
stefcoinc emmmacfarlane laurentianu interesting idea students sign contract,MacSweeneyG
insurrection declaration war philosophically,MacSweeneyG
sad day music lovers,MacSweeneyG
cmaconthehill stefcoinc nacci interesting description neighbourhood,MacSweeneyG
msbriggshdsb torontostar globeandmail tolerate positions agree tolerate find vile bc rec speech,MacSweeneyG
perreaux fantastic meat experience,MacSweeneyG
cbcr morning yep sing,MacSweeneyG
free letter word,MacSweeneyG
lack science tells good bad efficacy claims highly suspect,MacSweeneyG
suspect will trend volkswagen outsold rig emissions,MacSweeneyG
grown threats target soft targets parisstyle,MacSweeneyG
mlinstitute tashakheiriddin ian greene topic,MacSweeneyG
joshuahind terryglavin markbourrie mattgurney rowancaister,MacSweeneyG
mattgurney rowancaister terryglavin joshuahind state attacks french duty respond duty french,MacSweeneyG
illinoisrider vague freshness quality safety risk safety risk sick,MacSweeneyG
illinoisrider man tweet delete fast,MacSweeneyG
illinoisrider stefcoinc trolling carlsonlabs goedomega,MacSweeneyG
stefcoinc illinoisrider study accepted peer review chemist will submitting paper peer review,MacSweeneyG
mood left office vilified security concerns,MacSweeneyG
decision pmharper power infere elxn jkenney,MacSweeneyG
wow more father,MacSweeneyG
spartanvtyranny thomashall worlds conclusions theory justice,MacSweeneyG
talking bc situation dealt ohsheri mattgurney russilwvong fullcomment,MacSweeneyG
mattgurney ohsheri russilwvong fullcomment safe passage migrants,MacSweeneyG
rosiebarton iancapstick tashakheiriddin depending result sooner,MacSweeneyG
hey tompowercbc listen rock swings paul anka great underthecovers counts cancon,MacSweeneyG
richmondhillndp election hold seats statement vacuous seat,MacSweeneyG
dimocksusan sharing onfb emmmacfarlane cmaconthehill laurapayton find interest,MacSweeneyG
nspector academic knowledge area ban pass oakes test tomhawthorn dgardner,MacSweeneyG
bonkwazi collective talking cut individual rights robsilver,MacSweeneyG
century history course online read book,MacSweeneyG
nspector hosting debate excluding party awudrick charitable status heart argument,MacSweeneyG
paoconnell gavmac cmaconthehill stuartinthecage true love,MacSweeneyG
felt pain cat,MacSweeneyG
jandrewpotter libs serious damage cons appealed blue liberal side party elxn,MacSweeneyG
depressing concerning elnx change voting structure,MacSweeneyG
nspector course billion aid,MacSweeneyG
nspector statement straight binary option question pm motivated,MacSweeneyG
wait thomasmulcair wrote piece sun,MacSweeneyG
stephentaylor unduly influence third party audit independent seat government job justice system,MacSweeneyG
mdentandt residency norm number pms precedence,MacSweeneyG
laurapayton celiacs nightmare,MacSweeneyG
robsilver minutes good cpc will attack ad jt,MacSweeneyG
ian greene senate reform love hear thoughts craigscottndp pierrepoilievre honstephanedion,MacSweeneyG
definitely picture canadian federalism,MacSweeneyG
cents cmaconthehill stuartinthecage stefcoinc gavmac laurapayton,MacSweeneyG
bruceanderson katewheeling initiatives introduced metropolis recycling programs aiding cash strapped cities,MacSweeneyG
nationalpost changing issue issue arises reasons changing colours seismic shift better good reasons,MacSweeneyG
jandrewpotter scottreid ottawacitizen question portion cons vote jump libs avoid pm mulcair,MacSweeneyG
markdjarvis pmlagasse disciplines lend public engagement,MacSweeneyG
fsorbara jkoblovsky list civil libertarian surely voting cpchq ndphq,MacSweeneyG
geddes journodale aaronwherry term limits problem scc senate reference strong note tenure required,MacSweeneyG
kinsellawarren word duffy,MacSweeneyG
realdarrencohen nhl season bit life,MacSweeneyG
actiongeologist leftardhockyguy harmful offensive,MacSweeneyG
actiongeologist leftardhockyguy accountable,MacSweeneyG
kids fun playing long weekend bath water swamp waterman dirty fun,MacSweeneyG
peterkimglobal globalnewsto park,MacSweeneyG
stefcoinc uberfacts breasts strike unionized couple years ago sessions,MacSweeneyG
liberalparty justintrudeau typo,MacSweeneyG
brynnbeard department thinking critically,MacSweeneyG
hollywood sins vans warped tour battle bands follow click warpedtour hollywoodsins sinners,MacSweeneyG
great read nato articlev upheld,MacSweeneyG
mrsinisterlefty laurapayton feeling left claiming claiming left win,MacSweeneyG
mrsinisterlefty laurapayton constant presence regularity suffice,MacSweeneyG
globalnewsto buy beer beerstoreboycott blackmailing customers monopoly disgusting,MacSweeneyG
cbcthehouse evansolomoncbc bobrae typo read,MacSweeneyG
chastonb fareestweetable ctvmercedes sending message engagement choosing vote bc choice apathy,MacSweeneyG
fee increase force baseball club field,MacSweeneyG
shauntanakays puzzlement mandatory voting will change institutionalsystemicissue,MacSweeneyG
ethicsblogger help connect head wall,MacSweeneyG
eekfarms councillor glad twitter forward tweets,MacSweeneyG
natnewswatch ivisonj acoyne tie hands opponents,MacSweeneyG
cmaconthehill three kids forty years making,MacSweeneyG
justintrudeau special envoy staffan de mistura warned faces spectre srebrenica,MacSweeneyG
walked flooded office morning frosh blocked urinals doori hate dispose books gifted,MacSweeneyG
cmaconthehill laurapayton excuses,MacSweeneyG
stephen harper changes version events phone call beverley mclachlin torontostar,MacSweeneyG
medfoods interest pivotalthr announces patent omega medicalfood vascazen obesity diabetes cardiovascular,MacSweeneyG
baby born close,MacSweeneyG
cmaconthehill suck buttercup,MacSweeneyG
drake builds pc,MattSkiing
realized played good rpg terribly wrong,MattSkiing
iron maidens greatest thing,MattSkiing
nutella treats coming tim hortons ctv news,MattSkiing
win lose game,MattSkiing
watch eslone katowice check raffle awesome gaming gear,MattSkiing
carrying drum key,MattSkiing
sunshinevillage dive considered slackcountry,MattSkiing
vinnie colaiuta attack lb pizza youtube jesus christopher awesome,MattSkiing
youtubeanderzel contest anderz,MattSkiing
wonder elder scrolls will thing,MattSkiing
song linkin park feat hamilton,MattSkiing
sierratheresar antijokeapple bad,MattSkiing
going ski school today,MattSkiing
people don country hope listening eric church favourite,MattSkiing
cs opening weapon cases giveaway youtube,MattSkiing
newschoolers turns year mtstlouis,MattSkiing
lol threw leafs sweater ice,MattSkiing
pumped start hockey week,MattSkiing
lol active things playing computer,MattSkiing
twitter account character popular movie people time hands,MattSkiing
lol android emoji works,MattSkiing
bike stolen mcdonalds thomas glen erin pm today text asap white green nakamura,MattSkiing
metallica live die,MattSkiing
danielcalabres lol classic,MattSkiing
poorboyzlive chads gap,MattSkiing
man sunshinevillage weekend skiing,MattSkiing
house invaded ants,MattSkiing
madelncanada ryanjamieson error server find requested installing program,MattSkiing
twitcon mt st anne,MattSkiing
raptors game sooooo sick bad lost,MattSkiing
follow jaggonzaga stay updated happenings school community,MattSkiing
robotics exam will question worth marks,MattSkiing
major leak fireman,MattSkiing
cottage perfect pond hockey skates,MattSkiing
skied course intense,MattSkiing
djing couch plugdj playing rush red barchetta will admin,MattSkiing
ohmzapp omg calm,MattSkiing
guy apply cadbury global control manager,MattSkiing
lol letter parents campin august,MattSkiing
etholp etho mindcrack smp episode quartz tragedy youtube tragic,MattSkiing
nickb file sharing people network,MattSkiing
vintagebeeflp youtube haha watching gennys stream laughing hard pigstotheslaughter,MattSkiing
seanpettit day life high school,MattSkiing
vanedeluca eds apple releases beta registered ios developers torrent websites,MattSkiing
amazon shipped weekends,MattSkiing
lol tweeted ipad ios simulator computer app testing,MattSkiing
thinbodycutskin stay strong hope,MattSkiing
lol love spread eagles,MattSkiing
awesome family day,MattSkiing
making science notes,MattSkiing
phineas ferb ohh perry,MattSkiing
check side bury face snow,MattSkiing
hate filling paperwork,MattSkiing
omg destonys child reuniont ya cares,MattSkiing
ya happened today school,MattSkiing
lol cute lil bugger,MattSkiing
company previous tweet,MattSkiing
watching hard rock calling bell fibe tv hifi hardrockcalling,MattSkiing
yum christmas leftovers,MattSkiing
awesome christmas luv family,MattSkiing
man hope better,MattSkiing
finally stopped mattskiing mattskiin booyah,MattSkiing
concert soooooo awesome,MattSkiing
laurenxo skiing chirstmas break sameeeee,MattSkiing
thatarabdev add contacts add email apple,MattSkiing
guys sign dis petition internet free freeandopen,MattSkiing
red civies day works,MattSkiing
yeeeessss argos grey cup champs,MattSkiing
skierproblems going vt ski,MattSkiing
tired finished hockey,MattSkiing
songsonshuffle rock ages,MattSkiing
gforce today seconds stillcounts,MattSkiing
lol modern family funny awesomeshow,MattSkiing
minecraft pocket edition update,MattSkiing
people talk lot,MattSkiing
braveselric kevingetem ofcoodarwg leaglized colorado washingto state,MattSkiing
followers live canada kazakhstan create map,MattSkiing
samsung galaxy tab ipod family pin connectors zune pin connector,MattSkiing
hope lots money,MattSkiing
thundromon gonna meet libary,MattSkiing
tomyfutureson playstation turn iphone going skiing going,MattSkiing
watching ojhl game,MattSkiing
awkward moment real absurd trend find magicalpowercupcakes,MattSkiing
wanna watch number,MattSkiing
wear halloween costumes zaga,MattSkiing
europe eat morning continental breakfast,MattSkiing
gonna hard morning,MattSkiing
coke cold tho,MattSkiing
vote man killed osamagreat job bruce,MattSkiing
stoked sundays concert,MattSkiing
huge truck filled propane tanks rite,MattSkiing
holyyy crap debate heated,MattSkiing
braveselric ya jelly,MattSkiing
yikes degrees redbullstratos,MattSkiing
tired tweet characters,MattSkiing
canadas wonderland street view,MattSkiing
lol meeting hairy club members,MattSkiing
thatarabdev week till cast nice,MattSkiing
ommmmmggggg bad call,MattSkiing
watching sportscentre school,MattSkiing
ipad mini will announced oct,MattSkiing
going soooooooo fast,MattSkiing
watch likes hunger games,MattSkiing
rush strugers sick,MattSkiing
tweeting live gym,MattSkiing
vimanala necklace questions,MattSkiing
best time wear striped sweater,MattSkiing
omgfacts top video game picture facts favorite mind blown truestory,MattSkiing
today kinda sucked,MattSkiing
finished geo assignment geo assignment,MattSkiing
myfavouritelyrics good easy good free,MattSkiing
wow day screwed homework,MattSkiing
wierd bumpy road,MattSkiing
weeks nice days,MattSkiing
wtf facebook contacts mixed contacts phone,MattSkiing
timmies frozen lemonade nasty fully melted,MattSkiing
stoked nice bike ride tommorow,MattSkiing
phone messed service pretty coverage canada wifi,MattSkiing
lol funny vid,MattSkiing
watched movie called desecnet,MattSkiing
day life professional drum technician drum magazine drummagrocks,MattSkiing
wizard late frodo baggins early arrives precisely gandalf,MattSkiing
awesome happy canada day weekend fbi il zscfeature youtube,MattSkiing
martinfleury mattskiin happened nite,MattSkiing
best minuets school dance history,MattSkiing
ahh missed tweet rabbits north america,MattSkiing
going play tennis,MattSkiing
yeeah grad mass,MattSkiing
mattskiin noooo iam,MattSkiing
mikedski sport crazier tricks bmx proof omggggggg watch everyon,MattSkiing
watched spider man,MattSkiing
happy bday sierratheresa leafs better,MattSkiing
happy bday oddfuturetime,MattSkiing
spider man soo buss,MattSkiing
snake battery dying,MattSkiing
oddfuturetime mine pwnd,MattSkiing
ommann best weekend,MattSkiing
friends awkward awesome times,MattSkiing
love cartoon telephone voices,MattSkiing
yee caught disemering murder,MattSkiing
view trends trending,MattSkiing
fangirling things sick,MattSkiing
hargen flargen dargen,MattSkiing
thing takes seconds load exit,MattSkiing
ohmzapp mattskiin mentionsomeoneyoulove mattskiin smells cow poo mentionsomeoneyoulovethemostthatsmellslikecowpoo,MattSkiing
toilet making wierd noises,MattSkiing
espnnhl kings devils,MattSkiing
public transit bus time nervous excited,MattSkiing
replacemovietitleswithbacon iron bacon,MattSkiing
cut finger pop,MattSkiing
stanley cup la kings jersey devils,MattSkiing
zuballl night match,MattSkiing
gotta move fast gotta move fast,MattSkiing
soccerswag passed tweets twiitrer longer,MattSkiing
woah twitters stuff,MattSkiing
yeaaa friday long weekend,MattSkiing
ommmmannn ceamiscle blue,MattSkiing
lukemartin panic attackdream theatre,MattSkiing
ummmm agt ummmmm,MattSkiing
lol phetunning told friends street puns laughing crazy,MattSkiing
yesssss guna nice,MattSkiing
good day planned,MattSkiing
ow sliced finger cutting fruit,MattSkiing
white txt tweeting reply,MattSkiing
woow downloaded app installed apps phone,MattSkiing
mikedski sunset booger,MattSkiing
phetunning eat bowl bran flakes hours coolbeands,MattSkiing
bobbybrown hopefully will favourite avenger,MattSkiing
wo better wifi connection house living room smh,MattSkiing
daviddevids hey pleae watch vids views,MattSkiing
tweets compared oddfuturetime annadeguzman kenlondon sierratheresa,MattSkiing
gts the day,MattSkiing
phetunning fegde film,MattSkiing
hope obsess weeks finals haha studentlife,Nounnno
tweet bismillah firsttweetforeverything,Nounnno
today simple terms,RowanMMolloy
troyesivan toronto dates,RowanMMolloy
jamming sick music greysonchance,RowanMMolloy
kiss work lit remixes help djclymaxxx,RowanMMolloy
troyesivan toronto dates pls,RowanMMolloy
tronnorfravan trust bows,RowanMMolloy
troyesivan kinda dates,RowanMMolloy
troyesivan inside sick,RowanMMolloy
evanedinger feel man,RowanMMolloy
troyesivan follow canadians,RowanMMolloy
loving troyesivan youthvideo,RowanMMolloy
nice work troyesivan youthvideo,RowanMMolloy
wow youthvideo troyesivan,RowanMMolloy
holyshitsivan super excited friday forever,RowanMMolloy
troyesivan blue moon,RowanMMolloy
vikkstar days die,RowanMMolloy
corradocoia screening toronto,RowanMMolloy
ashleymardell best decision,RowanMMolloy
troyesivan troye wtf,RowanMMolloy
troyesivan blueneighbourhood trending king,RowanMMolloy
nanowordsprints hufflepuff won,RowanMMolloy
toronto blueneighbourhood tickets sold,RowanMMolloy
guess write today,RowanMMolloy
day fully caught nanowrimo,RowanMMolloy
writing easy today hopefully stays nanowrimo,RowanMMolloy
uninspired writing today day working hard tomorrow nanowrimo,RowanMMolloy
nanowordsprints great awful usual week,RowanMMolloy
novel changed direction better delete nanowrimo,RowanMMolloy
donated doubleupday nanowrimo saved writing ways,RowanMMolloy
day today strong extra sleep change tomorrow day nanowrimo,RowanMMolloy
kimkali nanowordsprints close,RowanMMolloy
dealynn nanowordsprints congrats,RowanMMolloy
tarp moving repeat tarp moving min game start cometogether,RowanMMolloy
pass time nanowrimo starts going nanoprep,RowanMMolloy
baseball hit won series bluejays caf,RowanMMolloy
mutantcanuck read short books middle ages help lot writing,RowanMMolloy
mutantcanuck fantastic worth tickets free helped,RowanMMolloy
calendar calendar nanowrimo,RowanMMolloy
year plan write tonano time excited nervous nanoprep,RowanMMolloy
brighthappyplnr year likes stray nanoprep,RowanMMolloy
embeetree write fun parts fill gaps entertaining scenes easier write nanoprep,RowanMMolloy
friend mine beautiful art style draws characters nanoprep,RowanMMolloy
nanowrimo hamilton person nanoprep,RowanMMolloy
jasminedawn hello nanoprep,RowanMMolloy
kaciecruise nanowrimo year,RowanMMolloy
year nanoprep season tips writing high school nanorebel planner,RowanMMolloy
corradocoia talk positivenegative comments vlog,RowanMMolloy
decided officially start editing btsov novel years ago printed createspace nanowrimo,RowanMMolloy
feel woke tired,RowanMMolloy
simple pleasures pencil paperwriting poetry,RowanMMolloy
going imitation game excited,RowanMMolloy
best thing room charlestrippy love ctfxc charlestrippy,RowanMMolloy
perk hankgreen realkgreen movie commentary soexcited p,RowanMMolloy
perk hankgreen jobogro nerdfighters art p,RowanMMolloy
winners goodies love nanowrimo,RowanMMolloy
corradocoia healthy corrado better moved hours,RowanMMolloy
kristanbremner don cherry jellybeantie canidropshroomsinyourcloset kaciecruise,RowanMMolloy
nanowrimo coffee left,RowanMMolloy
finally sitting writing time day nanowrimo,RowanMMolloy
late night writing nanowrimo writer,RowanMMolloy
unrelated bothers lot title better start working nanowrimoproblems,RowanMMolloy
jessann whoo hoo,RowanMMolloy
lovelockeprince raining umbrella help,RowanMMolloy
kendramase written week finally bouncing hour day short time helps,RowanMMolloy
wanted to tonight feel pretty terrible tomorrow,RowanMMolloy
johngreen hankgreen swusug realkgreen john,RowanMMolloy
plot bunny month nanowrimo nanoproblems,RowanMMolloy
honestly novel going writing nanowrimo,RowanMMolloy
early celebratory cake alextwestlake,RowanMMolloy
frinightwrites anginicole hello,RowanMMolloy
totally hit total today track nanowrimo amwriting nanowrimo,RowanMMolloy
tbt mutt grew fast,RowanMMolloy
booktrack interested tomorrows playlist will written site hmm nanowrimo,RowanMMolloy
frinightwrites big writeclub statsguy,RowanMMolloy
hitting dream today nanowrimo,RowanMMolloy
todays goal currently nanowrimo,RowanMMolloy
cantrelljason nanogeekette twitter supposed min,RowanMMolloy
nanowordsprints jumped halfway current total,RowanMMolloy
days nanowrimo nanoprep,RowanMMolloy
celiamcmahon find rowanmolloy,RowanMMolloy
love years calendar nanoprep iamcrazyexcited nanowrimo,RowanMMolloy
charles wren milo todd dr munro character names nanoprep,RowanMMolloy
phone charlestrippy tweeted iphone wrong,RowanMMolloy
nanowrimo sushimustwrite thebratface extra day write thanksgiving november canadianproblems,RowanMMolloy
nofilter photo canon rebel xt,RowanMMolloy
cbc sponsoring event phone cases adorable,RowanMMolloy
rhettmc linklamont legitimately nicest people honestly care mythical beasts bufferfestival,RowanMMolloy
rhettandlink landed soft batch pillows rlstory,RowanMMolloy
pmshinexxx feels great years sweet feeling,RowanMMolloy
corradocoia coreyvidal hydration rest tea,RowanMMolloy
dawnmariaaz nope years win whynano nanorebel,RowanMMolloy
nanowrimo talk forum completely fail,RowanMMolloy
mazerunnermovie mazerunner heart attacks fun,RowanMMolloy
threewordsshewantstohear brought pizza alextwestlake,RowanMMolloy
charlestrippy happybirthdaycharles dragon,RowanMMolloy
glasses glory sarad corradocoia alsicebucketchallenge,RowanMMolloy
queenofheii rhettandlink email bufferfestival tweet corradocoia,RowanMMolloy
saskiavanell loved vlogs excited appeh team third time buffer,RowanMMolloy
ugh hours hour nap consciousness nyc,RowanMMolloy
nanowordsprints nope distracted,RowanMMolloy
nanowordsprints will better,RowanMMolloy
great start campnanowrimo amwriting,RowanMMolloy
day filled drawings art drawing chill,RowanMMolloy
drawing drawing drawing art drawing,RowanMMolloy
stayin alive stayin alive habs lead becauseitsthecup,RowanMMolloy
pacioretty habs becauseitsthecup,RowanMMolloy
lakings coming will,RowanMMolloy
nanowordsprints murder time best sentence figure going reanimate alright,RowanMMolloy
nanogeekette book store thinking,RowanMMolloy
nanowordsprints silliest song planet kristenecollins fight scene brewing,RowanMMolloy
dog learn kicking sleep ow,RowanMMolloy
currently listening tracks playlist whilst writing campnanowrimo motivation,RowanMMolloy
nanowordsprints year write project july,RowanMMolloy
biggest thing noticed tsbnick classes tech person icantfixyourcomputer letmework,RowanMMolloy
read paper towns realjohngreen reading,RowanMMolloy
woke sleeping dog gardiner tmltalk,RowanMMolloy
frinightwrites danceturnipparty favourite hashtag,RowanMMolloy
frinightwrites months ready write writeclub projecteastman,RowanMMolloy
vocal class daft punks doin refuses leave head,RowanMMolloy
live students telling calm lighten expect teachers bit kind anxietyproblems,RowanMMolloy
guess kolbetweets putting student week sweet,RowanMMolloy
gusrachels canadian dollars,RowanMMolloy
baileyrufer current count,RowanMMolloy
beautiful bozak goleafsgo,RowanMMolloy
panic attack ottawa grade anxiety bellletstalk,RowanMMolloy
bellletstalk beautiful bellletstalk,RowanMMolloy
thought robots crushed apart frcquotes,RowanMMolloy
nanogeekette yay progress,RowanMMolloy
year lot interesting rightbyyou,RowanMMolloy
nlibrisveritas moffat gatiss wrote,RowanMMolloy
partnersformh video hope enjoyed,RowanMMolloy
current length video minutes exactly meh,RowanMMolloy
time finish btsov won will writing slower steady icantbelieveiwonthough nanowrimo,RowanMMolloy
question validate going permanent count nanowrimo help abouttowin,RowanMMolloy
thesprintshack joining momentarily today win ktogo korbust nanowrimo,RowanMMolloy
nano frozen today beautiful lots songs best movie incredibly good,RowanMMolloy
time big fight scene nanowrimo ktogo,RowanMMolloy
nanowordsprints close goal korbust writer will win nanowrimo iamonfire,RowanMMolloy
cantrelljason update count bring nanowrimo thisisnowbotheringme,RowanMMolloy
