Tweets,Follower
rilaws quietwhisper talking guest felicity,AHKru
mandydennison oooh good,AHKru
shout guy announcing stops rod roddy style publictransit canada,AHKru
soo boys win,AHKru
kate bosworth pulling shoulders hard muster strength gorgeous dress goldenglobes,AHKru
astronomymag hemibenno check,AHKru
chaptersindigo delivers order store days ahead schedule yas,AHKru
good hear team telusmobility loving blackberry priv spread good word priv android canada,AHKru
congratulations aeryonlabs nattykate,AHKru
add priv list favourite letter blackberry android musthave,AHKru
nattykate pretty awesome,AHKru
gojaysgo jays fever,AHKru
day delay grtrow buses showing goodbye connections,AHKru
late post people kw gilt dtkitchener brunch damn good awesome quality,AHKru
happend qtip good,AHKru
finding going zizi pretty stellar wrap week,AHKru
life shialabeouf good robcantor,AHKru
yup book boardroom discuss gameofthrones finale coping skills coworkers tmr fuck hbo,AHKru
good night dave laughs lateshow daveletterman thanksdave cheers entire late crew,AHKru
bff sends link summer plans meghanrocca osheaga yassssss,AHKru
theborisdiaw spurs spurscoyote will blowing spurs fans maggieyepes,AHKru
bbmattk wow time warp loads memories good great pic,AHKru
eddykayla resident cat lady owning proudly,AHKru
eddykayla power thor,AHKru
ninja ninja tmnt hallowinning bbmattk,AHKru
mediaobsessed shutting shite,AHKru
shy tonight cool will fitspo cyling,AHKru
pffft day internationalcoffeeday coffee kaffee caf,AHKru
eddykayla living embodiment buddy mdear,AHKru
special kind champagne birthday today celebrating blackberry passport arrives wait,AHKru
eddykayla blood bath lolz,AHKru
holy humidity easy hustled fitness cyling,AHKru
wow azzurri knees che vergogna blame humidity congratulations uruguay races worldcup,AHKru
wow handing free kicks penalty shots caipirinhas opening match brazil brutal worldcup,AHKru
happy memorialday upper upd puremichigan,AHKru
love bowie love janelle monae love worldcup beautifulgame pepsi,AHKru
magic moments bella italianofilter,AHKru
nofilter una buona giornata,AHKru
meet rotunda dollar,AHKru
dear finaldraft creeping screen going brilliant totally unique overwhelmingly awesome,AHKru
editing best bbm instant msging video voice calling check check check,AHKru
starbuckscanada blonde day day,AHKru
vogue paired great videoint wsjp blackberry loveteamblackberry,AHKru
thankfully touque brunt hit canada,AHKru
love boys playlikeagirl gocanadago cdnolympicteam,AHKru
sooboys olympic broadcast today ted nolan coaching latvia teambradjacobs hustling curling semis,AHKru
brilliant audi ad nailed,AHKru
teslamay cdnolympicteam heart full canadian,AHKru
zapposservice lol will zappos service,AHKru
watching thegrammys red carpet headache makeitstop,AHKru
nights good fitness gohard,AHKru
emma thompson magic epic legendary good things goldenglobes,AHKru
leos jacket small buttoning second button goldenglobes,AHKru
enjoyed msging friend leaving caribbean won winter today bitterbitterly cold,AHKru
dior commercial jadore feat charlize marilyn grace airing lot pitchperfect,AHKru
long day travel destination,AHKru
time week will bella italia che meraviglioso,AHKru
dkny lol wellrounded lady beast,AHKru
serdatweets thecut nymag canadian wore canadiantuxedo uk day felt odd chic lol,AHKru
hey fashionistacom love check hyperlink bad gateway,AHKru
hey alizalicht cape lover to capes bring decide thegreatcapepurge,AHKru
skyscanner easy canada big sky country stunning vivid colours,AHKru
skype reinstating credit dormant year living overseas skype bbm indispensable,AHKru
love grassmarket district edinburgh excuse mobile fab it,AHKru
easy favourite karliekloss ridiculous red dress amazing iwant dkny great happy anniversary,AHKru
dkny caught talking loud blackberry hangs head shame lol time,AHKru
alexkinsella successful dialogue german client erfolg,AHKru
jnicoledub congratulations jenna,AHKru
bbmattk better wearing helmet protect melon,AHKru
hey canada helpful wireless wan pay sister koodofido better plans buy device,AHKru
ericalotman lol thought complete padre pio,AHKru
consumers going realize pared note ii,AHKru
worked tv oprah scenes porn gah familyday,AHKru
mediaobsessed bold wait,AHKru
church morning witness fitness,AHKru
markpgibson widest bean pole totally ridiculous,AHKru
wonder apples expensive iphone samsung making parts,AHKru
holiday thoughts tis season foodie will true foodie afraid indigestion eat,AHKru
good ladies read enjoy happy sunday,AHKru
vmochama good books,AHKru
elusivebalance oooh eating good olkw cafes,AHKru
kaymichl good luck winter west,AHKru
teslamay le sigh explanation needed,AHKru
watching wigan fullham sportsnet perfect saturday filled epl,AHKru
angelicize feeling today daniel johns beautiful man eyes lol,AHKru
elusivebalance totally agree amanda tweeps chaps ace,AHKru
singyshih wave fingers writing wellplaced finger point change,AHKru
road ontario beautiful today,AHKru
isragana ha love,AHKru
sound countless fans tossing livestrong bracelets swoosh,AHKru
mandydennison joel plaskett uber canadian anddddd mentions soo light moon,AHKru
magician call vajayme afternoon months making ready jayme,AHKru
singyshih youuuu best,AHKru
canada excellent steeze beastmode,AHKru
aliceluong safe assume aced,AHKru
teohalbert maggieyepes merciersara definitely albert wins loses lol,AHKru
conversations overheard hospitals range horrifying uplifting funny uncomfortable oversharing waiting rooms,AHKru
beast mode federer murray totally winning speech good ya kid,AHKru
great live border town celebrating canada day july festivities commence happy canada day,AHKru
nora ephron lost magic tonight,AHKru
philip lahm beauty,AHKru
happy fathers day dads special shoutout pop big,AHKru
call game devils game,AHKru
love passion unites promo sportchek euro,AHKru
maggieyepes luis will love discount buying set lol,AHKru
mediaobsessed lol will reserve cheap night movies paying full price riggo,AHKru
late party avengers rocked marvel jonfavreau joss whedon hammer,AHKru
pepsi twitter lock week long ad deal pretty simple concept find adage,AHKru
blackwater mad bloody tonight gameofthrones mustnt,AHKru
love love baby ripdonnasummer,AHKru
worse writing bible brain hurts,AHKru
tweeps head canadianprowrestling touring canada checkem u tix,AHKru
jbkruschack day album pretty awesome,AHKru
chirpy flyers fans tonight pens,AHKru
kinds awesome techvibes timmyrun,AHKru
deadline team effort twitter shoutout isragana martinkay merciersara,AHKru
afternoon tweeps hope friday going great special nattykate lady twitter gr tweets,AHKru
elusivebalance lots love amanda,AHKru
louisville kentucky game awesome second quarter,AHKru
disappointed mad men season premiere hbo madmen,AHKru
great birthday celebrations st pattys great friends xo,AHKru
sunny toronto moment mad global warming,AHKru
goodbye blackberrylandia kw twas great weekend xo to,AHKru
hey andersoncooper watched definitely interest stopkony,AHKru
martinkay ooh heard hungry martin lol,AHKru
ted prometheus coming excited excited genius campaign,AHKru
girl talk triple double,AHKru
kaymichl ooh good,AHKru
dears sault friendsfriday lop lops friends littlecitymusic play good pplgood drinksgreat music ittell tweeps,AHKru
angelicize lol longer,AHKru
adding phantogram listening list ugh love souping torch bbmmusic jams,AHKru
definitely soofood ugh,AHKru
loving living lake shore today april,AHKru
isragana martinkay vernetteeugene stimulating,AHKru
bbmattk soo love,AHKru
judge listening jump lilkim love oldie goodie feels lol,AHKru
angelicize gavinslate littlecitymusic disappointed missing tonight booooo,AHKru
hey rimcareers quick question will grad career expo jan mtcc week,AHKru
mariorocchetta dear friend mention scared cross bridge big brother watching creeeeepy,AHKru
bbm software updates folks fresh oven bbm bust,AHKru
rimcareers retweet great weekend,AHKru
ladies cheap minifacelift trick pretty minutes bare face lol,AHKru
kaymichl saultites major driving balls fail,AHKru
hoping loveliness nye starbucks order,AHKru
lupinis calabrese understand,AHKru
taggio gorgeous i uber canadian,AHKru
aliceluong definitely sad yay,AHKru
free redbull library,AHKru
task strive simplicity clarity interest repetition main point,AHKru
listening littledragon night ritualunion,AHKru
mediaobsessed feel very,AHKru
happiest birthday cuz dianamedaglia xoxo,AHKru
final feelin second wind kick,AHKru
citadel hell week,AHKru
streaming pens game homework lovin exhausted worth,AHKru
ginooooooooo goal loving malkin great goal,AHKru
wishing melissacugliett happy birthday pseudooldie club cugz,AHKru
love cut suit man capped handsome pocket square classic style,AHKru
martinlindstrom presentation today amazing insightful inspiring,AHKru
tonight calls neil young heartofgold,AHKru
blackberrynews great post kevin,AHKru
day sublime playing night,AHKru
pretty awesome enjoy halloweeners,AHKru
mariorocchetta friends rad,AHKru
early ladies running things sportsbiz melindatravis katrinakaye hmcharles check website,AHKru
mariorocchetta agreed friend,AHKru
coachkhamilton coach good,AHKru
shout blackberryhelp working restoring services going bbm withdrawl,AHKru
happy thanksgiving sault ppl family friends you kw fam havin,AHKru
hounds win tonight great job boys ohl,AHKru
capping night studying working assignments season premiere dexter,AHKru
good night hockey books habs hounds,AHKru
kaymichl sweet enjoy weekend babycakes,AHKru
great campaign blackberry love blackberry bbm superfan check,AHKru
geeze finally littlecitymusic,AHKru
ricob pic rick rhyme,AHKru
week complete freakin weekend cheers,AHKru
kaymichl knee slapper loln place,AHKru
christinekorda witty woman treasure witty beauty powergeorge meredith quotes beauty women love,AHKru
omg crazy night cbsbigbrother things carazay,AHKru
hope friends goderich tonight weathers supposed pretty bad,AHKru
awallenstein breaking breakingbad return amc reaches episode deal sony link coming,AHKru
mariorocchetta feel pain mario best worst thing lol,AHKru
wow wow wow fascinating murdoch newsoftheworld,AHKru
amandarubin everyones week start animated love story lol,AHKru
patmcgrathreal hey pat favourite high endlow makeup remover,AHKru
degrees celsius july typical canadian summer day tmr going figure lol,AHKru
merlottes goodnight trueblood hbo,AHKru
great day winnipeg jets nhl,AHKru
wishing canadian tweeps pleasant relaxed victoria day st long weekend kick summer enjoy,AHKru
amandarubin lol awesome relaxing enjoy,AHKru
lighter note enjoy sweet playbook ad vl qckqd feature playerembedded,AHKru
diane kruger killing jason wu metgala,AHKru
love dress mcqueen foe win royalwedding,AHKru
happy easter frohe ostern buona pasqua tutti hope chocolate filled day lots love,AHKru
cest bon plekanec beauty,AHKru
game time gohabsgo nhl,AHKru
black keys push wednesday afternoon sidenote playoffs tlspj mm,AHKru
amandarubin will to soo soo michigan styles cheap cocktails palace will change life,AHKru
summertime downnn good night tweeps,AHKru
bit presumptuous buy sandals week snow sault fail,AHKru
bell media logo time morning lookin good,AHKru
tweeps live profile shot smartphone users unite,AHKru
blackberry lovers unite good morning playbook will launch april woohoo,AHKru
exactly ad time nissan buy enjoy spots wondering robert downey jr vos nice touch,AHKru
watching bachelor finale stressful bad,AHKru
capital leave snow,AHKru
mediaobsessed ruined surprise montage obvious,AHKru
mediaobsessed good luck diana,AHKru
thisisfrances bachelor top model starts week excited judgment,AHKru
definitely black keys music kind day,AHKru
thisisfrances good bad,AHKru
mediaobsessed things tough yay,AHKru
john legend handsome face,AHKru
tweeps bbm monday hit green button bbactually call valentine guess habs win softie,AHKru
gem baby photo guess homage toddlers tiaras circa mid,AHKru
sooooo tonight boston ouff looked wednesday night reggies nhl mtl,AHKru
pens caps superbowl nfl descent sunday,AHKru
mariorocchetta mario valentines day cards killllllin lol,AHKru
loving pk subban flowers twirls,AHKru
celsius days love winter freezing canada,AHKru
ricob wise friend wise,AHKru
aaron sorkin great speech exquisite,AHKru
congrats erinkaplan wait kill teen vogue getem girl,AHKru
hey blackberry blackberryscene great playbook ads real thing goods,AHKru
second period canada blowing game worldjuniors,AHKru
perezhilton sell canada delicious kinder eggs favourite,AHKru
board nice goal foligno worldjuniors,AHKru
enjoyed st hbos penguinscapitals series night,AHKru
finally blackberry recognition blackberry rim,AHKru
tempted venture blackfriday will,AHKru
chicago wronghang tight sault,AHKru
thisisfrances patchouli stink outta high fidelity lmfao,AHKru
love digitalroyalty today queen elizabeth joins fbook conanobrien rejoins tv gotta feelin,AHKru
mediaobsessed year full head gear costumed head toe,AHKru
curtoneil find rate option website,AHKru
team amaroso slizzerd tonight lol sault shout bidus town,AHKru
degrees celsius cold snowing bought touque today working sorels spiffy coat,AHKru
appear mariorocchetta soo buzz weekends hunks yr event wout ticket,AHKru
curtoneil lol bigger hands jk,AHKru
fav expansion team pens original mtl playing enjoy game great hockey going mtl,AHKru
waffle thursdays alright,AHKru
suspect tim allen making bank voiceover work replaced james earl jones,AHKru
melissacugliett cents blackberry bbm,AHKru
today rock star love amandarubin,AHKru
hmmm choose nadal federer,AHKru
will picking october issue vanity fair,AHKru
dear rolling stone making today lot better madmen,AHKru
sportsbiz urself loving sport bogged biz sports takes magic,AHKru
prsarahevans red velvet petitfours,AHKru
amandarubin signs avail hold helping,AHKru
amandarubin hmmm reversal airport shittyness cuz fri awesome,AHKru
amandagravel evolving gotta fresh slammed competition,AHKru
mediaobsessed passthegin guys killing lmfao good luck diana,AHKru
canada guard bears guard dogs bears,AHKru
mandydennison best good brother,AHKru
katrinakaye listing sportzbiz,AHKru
amandarubin mandydennison team amazingness lol,AHKru
biking bruised tail bone good idea learned today,AHKru
better wednesday cute tanned sailors friend,AHKru
mariorocchetta lol guess going rotary fest weekend,AHKru
curtoneil checked tuscany weddings pics awesome pat good sir,AHKru
running shoes road track thinking reebok runtone thoughts,AHKru
missing elton john concert tonight thumbs,AHKru
fernando torres difference maker eurocup years ago esp riding bitter bus today worldcup,AHKru
bet lbjs decision ws jerseyshore shot miami millfist pumps hear snookies mascot heat,AHKru
curtoneil true story happy soccer bubble june stage underway forget,AHKru
curtoneil awesome grooveshark iceberg radio,AHKru
lukas favourite player firing ball ger,AHKru
williamryounce hey maple syrup belle ball canadanobody puts baby corneri prefer medium amber syrup,AHKru
great studio built soundproofed weekstudio coming alongteachers students excited learn,AHKru
win boys germany smelling fragrant worldcup ger,AHKru
mediaobsessed read thought talking lol,AHKru
john isner legend isner wimbledon,AHKru
mediaobsessed upchuck mouth thinking damn movie disturbed,AHKru
peach gary lineker football simple game men chase ball minutes the germans win penalties,AHKru
better feeling person starting career motivation,AHKru
germanys match today defined called beautiful game worldcup,AHKru
boy cheeky zawe elbme worldcup,AHKru
blackhawks magic game mad ave,AHKru
good bio read suggestions,AHKru
rip dennis hopper,AHKru
thisisfrances poutine heart hurt,AHKru
habs tisk tisk,AHKru
feels deleting things people today,AHKru
puck drops tonight watching folks,AHKru
wtf snow really,AHKru
mediaobsessed start petition shit banish tom lost,AHKru
elton john tickets,AHKru
commit heebie jeebies,AHKru
mediaobsessed room strung teens heart,AHKru
thisisfrances mega lol poor thing grumblies tumblies,AHKru
true blood promo,AHKru
people smash cream egg face despite love great cream egg morons whining,AHKru
waiting patiently secret diary finish watch,AHKru
man fucking crying omg,ATMXO_
el em ay ohhhhhhhh,ATMXO_
move forward happen,ATMXO_
she god shoe christian,ATMXO_
wow died la fitness today,ATMXO_
el em ay ohhhh,ATMXO_
quick react awkward situation work aries,ATMXO_
fuck wit bitch nigga,ATMXO_
michellesarah happy birthday michelle hope amazing live girly,ATMXO_
devikathakur omg whens bday girly lol best,ATMXO_
devikathakur spent hours pictures lost ten hidden,ATMXO_
twelveofspades baybeehmiina extremely fond instigating stating factsduuh,ATMXO_
devikathakur check app google photos dropbox mightve automatically backed,ATMXO_
experimenting variety methods reach satisfaction aries,ATMXO_
eaten pmhow hungry,ATMXO_
baby youre wanted,ATMXO_
devikathakur girl worst crowd youi walking lol,ATMXO_
loved missy elliots,ATMXO_
jeeez drugbarton map,ATMXO_
yooooooooooooooooooooooooooooo crying lmaoooooooooooooo,ATMXO_
regret choosing include people parts life bc image forever implanted memories,ATMXO_
employees attitude mistake,ATMXO_
gurit block instagramlmao,ATMXO_
ready set fire today order achiev aries,ATMXO_
stroke ingenuity solve problems spr aries,ATMXO_
intend catch unfinished business comple aries,ATMXO_
helenaaatee raycayray low key high key peep love bit,ATMXO_
incredibly flexible today tha aries,ATMXO_
baybeehmiina opsies gg loll,ATMXO_
manage careerrelated issues based aries,ATMXO_
carmennirvana freaky liking approval,ATMXO_
heart shattered omg,ATMXO_
engaging work struggle today su aries,ATMXO_
sister fuck phone fucking ass bed holy fuck ima kill,ATMXO_
wouldve time life goal age three,ATMXO_
singh king singh king singh kingggggg,ATMXO_
motivational purposes guess reps lose form,ATMXO_
cold shoulder nice aries,ATMXO_
writinggoing grocery store milk going grocery store milk fits,ATMXO_
favorite thing empty lol,ATMXO_
wow accuracy post hmm,ATMXO_
coward nigga fake,ATMXO_
mad frustrated life listening music help,ATMXO_
trailing pack usual style today aries,ATMXO_
fiazrahim ha will,ATMXO_
baybeehmiina ya ima sleep,ATMXO_
ameenakaay yourfavoritezoe died countless times watching,ATMXO_
rashaawn baybeehmiina allah,ATMXO_
excitement mounts consider angle creative pr aries,ATMXO_
fucking cheese rn,ATMXO_
will today imaginatio aries,ATMXO_
assumed track realize aries,ATMXO_
markpersaud size jeans size numbers size lol kno,ATMXO_
sairahassan funny lol wtf,ATMXO_
help raise issues rathe aries,ATMXO_
booty good wit confident ass,ATMXO_
anils yea man dude life,ATMXO_
ready dat dickk likeee carmennirvana,ATMXO_
fiji water carmennirvana,ATMXO_
selling year west indian female cook round roti cleans pretty baybeehmiina,ATMXO_
dianaasamlal dream beautiful face day motivates wake morning iknowumissme,ATMXO_
event unexpectedly triggered emotions aries,ATMXO_
idgaf imabitch sobeit votingforrealchange votingforbae trudeaumania,ATMXO_
twelveofspades no no inspiring honesty,ATMXO_
machu picchu building,ATMXO_
friend coworker appears answers today ev aries,ATMXO_
birdtwinkle mine weird,ATMXO_
wow man wow yall niggas childhood,ATMXO_
lilo stitch cry single time,ATMXO_
facing bottle problems,ATMXO_
good guys dmventures,dreamakerrealty
view penthousefuture dm spot trailer townhouses start dream yorkdale,dreamakerrealty
wealth funds invested real estate year realestate,dreamakerrealty
view floor dream residences yorkdalestyle floor left,dreamakerrealty
great conversation rosen harryroseninc development yorkdalestyle,dreamakerrealty
great day dream residences yorkdale,dreamakerrealty
condo rental vacancy rate toronto centre region lowest city buzzbuzzhomefundamentals,dreamakerrealty
good day pouring concretefull action week,dreamakerrealty
average price condo toronto sq ft hamilton sq ft buzzbuzzhome,dreamakerrealty
toronto prices jump april year ago singlefamily listings short supply financialpost,dreamakerrealty
dream maker rogers tv,dreamakerrealty
days sales percent solddrive percent nov cont,dreamakerrealty
moneyteam playlil wayne justin hahahahah,dreamakerrealty
live stock exchange ring todays trading day min,dreamakerrealty
great time partners raptors vip eventgreat meeting nigerian gm president ceo forward working,dreamakerrealty
loving canadian nigerian investment weekendcreating relationships will help secure investments nija,dreamakerrealty
intersting articlegen gen wealth stagnates forbes,dreamakerrealty
toronto real estate clubfor canadian wealth investors forum,dreamakerrealty
canadians allowed contribute cpp reignite culture savings urges cibc,dreamakerrealty
congrats hon jean augustine grenada flag ceremony independence city halldream maker realty official partner,dreamakerrealty
crawford adventist academyfor president obama inaugural celebrationdream bighistoric times,dreamakerrealty
busy month start yearhighly anticipated launchstay tuneyorkdale,dreamakerrealty
break real estate disney ice fam,dreamakerrealty
financialpost housing market strong canadian prices rise october good news,dreamakerrealty
site waterfrontdreammaker showcar scene worknplay dmr lovewhatyoudo,dreamakerrealty
kevinolearytv press today olearymortgages forward role big market,dreamakerrealty
time build relationships floor bmo party dmr realestateinvestments,dreamakerrealty
lifetimedev dream started wave decade ago liberty village happy dmr believed,dreamakerrealty
signing unit york love buying tridel units,dreamakerrealty
realnetcanada places grow torontostar ft realnetcanada great read,dreamakerrealty
set tridel head office york projecttv crew thomas dmrtvshow,dreamakerrealty
ready holiday seasoninvestors waiting best,dreamakerrealty
forward hearing author everyday real estate millionaires toronto real estate club great job marcel event,dreamakerrealty
dreammaker rogers tv pm talking real estatebusinesseducation dmr dfh view triplex queen st,dreamakerrealty
adds jobs jobs expected canada jobs jobs expected read economy hmmmm,dreamakerrealty
hmilborne great job hunter pleasure stage,dreamakerrealty
walk ryerson people lined waiting iphones best buy things love lineupforbricks,dreamakerrealty
starting potential africadreammaker corporation team ready,dreamakerrealty
interesting article lot sounds very close suggestions yr ago dmrteam,dreamakerrealty
real estate bestdmrtakeover mrto dreammaker,dreamakerrealty
liferetirement bitch plan learn dmrs yr net portfolio plan client,dreamakerrealty
demand condos rise wow surprise lol toronto star jumping info,dreamakerrealty
dmrdfh locally internationally push ends dream bigger reality bigger tomovement dmrdfh,dreamakerrealty
going traffic jude lol,dreamakerrealty
equity game joke bloombergtv knight capital group losses trading breakdown,dreamakerrealty
real estate stockscondo houses thinking wo perspective waste brain energy,dreamakerrealty
great media finally word fundamentals explain real estate market well,dreamakerrealty
queen west percent upto percent cashback free parkingrental program buy mann dreammakers,dreamakerrealty
couple hrs speech dreammaker launch unique vertical integration real estate market big buyn incentives,dreamakerrealty
pic thinggolfing forward golfing rbc wealth mgmt team,dreamakerrealty
fearrules market renters builders better incentives buy rates stay low longer investors win love,dreamakerrealty
wify lil princessglow dark mini golfing fathers day,dreamakerrealty
dmr canada college business technology graduation ceremony great speech hon jean augustine congrats graduating students,dreamakerrealty
financialpost secondmentor ernst young insight core successful entrepreneurs,dreamakerrealty
dreammaker high upper forrest hill project best work,dreamakerrealty
dreammakers motto invest play wellstill time access panam games units going fast,dreamakerrealty
hear coo dundee realty bus pamam games site tour sweeeeet,dreamakerrealty
drive dp movement stay tune building today tomorrows millionaires,dreamakerrealty
feels good to tonow ready dream project st phase panam games village love game,dreamakerrealty
great sunday serviceholy spiritand power lives speaking engagement dmrdfh empowerment tour,dreamakerrealty
question hey guys find asset buy pays market good upsilence lol,dreamakerrealty
clear mind golf course,dreamakerrealty
movementpresentation dreammakerscalled previp likeinvestors shocked,dreamakerrealty
mannn pad tavira bonita baythats talking,dreamakerrealty
long week flipping real estate building location dmr forward hrs rest miaoooo game wthe team,dreamakerrealty
hard choices great annexcasa loma project easier time picking lvs thin makn money projects,dreamakerrealty
buzzbuzzhome canadian population lives urban areas wow urbannation bildgta,dreamakerrealty
uploaded youtube video dream maker realty annual black voices conference,dreamakerrealty
day weekmore bricks pushed gta dreammaker team york radio interview dreammakerrealtyca big,dreamakerrealty
kcamadi bro mrk,dreamakerrealty
big upmdot acn chq lol follow system saidlol hmmm golf season started today,dreamakerrealty
nice parking presentation starthistory making parking project gtaand ofcourse dream team,dreamakerrealty
expensive crazy presents massive compare,dreamakerrealty
ready speech financial empowermentownershipanother long daythen mini investors group yorville project,dreamakerrealty
pack roomthe startyoung learn build wealth real estate,dreamakerrealty
walkerlaw thx will great speech,dreamakerrealty
watchin american greed cnbc princesson baby broker scamgzzzz people will money nutsall greed,dreamakerrealty
canada china steps include free trade deal historic investment deals huge movements,dreamakerrealty
