Tweets,Follower
asosstylist asos find top luck stock,SallySan_x
biggest regret today napping wideawake,SallySan_x
chatimeuk open store liverpool afford travel manchester favourite milk tea,SallySan_x
specsavers collected lenses store march going hard prove months supply,SallySan_x
twitterversary twitter years apr,SallySan_x
god fuck couchtuner sort website,SallySan_x
wave radio entered fingers toes crossed,SallySan_x
londonfire elecsafetyfirst people dumb,SallySan_x
nice bath work,SallySan_x
people tight money,SallySan_x
long day cheshire oaks croft,SallySan_x
hate automated phone calls,SallySan_x
find decent work clothes,SallySan_x
hotelsdotcomuk vermont hotel hotelhunt,SallySan_x
bad sister completely forgot brothers birthday,SallySan_x
time roll bed start day,SallySan_x
gbcollege hey gb admissions cycle begun international applications applied st december,SallySan_x
hongbinss yeah week testing lipsticks,SallySan_x
zoeva brush sets expensive,SallySan_x
nb working glad three days,SallySan_x
hongbinss shopping cinema,SallySan_x
sister going town weekend bed oldage,SallySan_x
guy ordered meal walked pay mealdont,SallySan_x
hongbinss superstitious things,SallySan_x
win daisy marc jacobs worth sprinkleprizes sprinklecom,SallySan_x
win ladies rose gold plated michael kors watch model mk worth sprinkleprizes sprinklecom,SallySan_x
happy weather lot warmer roll summer,SallySan_x
win amazon voucher sprinkleprizes sprinklecom,SallySan_x
nb constantly posting food pics promotingobesity,SallySan_x
laptop piece crap support latest version java,SallySan_x
submitted application school,SallySan_x
gbcollege poor communication will submit application january,SallySan_x
nb yeah eat full stomach bed noget,SallySan_x
happened tulisas face drugs surgery,SallySan_x
comping fairy dryspells noluck,SallySan_x
debenhams order arrived time play,SallySan_x
gbcollege select countries citizenship but england uk allowed apply ece course,SallySan_x
mrkiplingcakes yay finally scousers,SallySan_x
excited black friday,SallySan_x
nb definitely going notes help,SallySan_x
nb sort questions interview,SallySan_x
nb bet will posting,SallySan_x
dog lovers check dog philly snapchat dogshowinphilly dogs doglover cuteoverload,SallySan_x
love nice palette toofaced remove box incase damage,SallySan_x
guess watch american horror stories iphone,SallySan_x
okmagazine davidbeckhamweb victoriabeckham beautiful pic,SallySan_x
time online assessment,SallySan_x
nb kind girl watch eat,SallySan_x
buy urban decay vice palette,SallySan_x
nb yeah cafe work sold red velvet cake popular huge fan,SallySan_x
nb claiming will find job november,SallySan_x
nb omg hope track ip arrest,SallySan_x
hongbinss find job save money,SallySan_x
hongbinss will beg jen eye lol,SallySan_x
piled pounds fatlife,SallySan_x
nb yeah guess,SallySan_x
nb excited cos spent xmas family years,SallySan_x
bucket list tomorrowland creamfields,SallySan_x
benefituk elleuk yay,SallySan_x
nb poked pen,SallySan_x
love faced palette everythingnice makeup,SallySan_x
chatimecanada locations live chatime opening stores liverpool manchester,SallySan_x
arghhhhhh week mobile number shit,SallySan_x
nb person tweet lol nofriends foreverlonely,SallySan_x
hate people partner,SallySan_x
nb yeah misleading haha,SallySan_x
hongbinss september congrats uni going,SallySan_x
nb long story good good,SallySan_x
blasting tiestos album,SallySan_x
finally dress aunties wedding,SallySan_x
nb lost weight ha,SallySan_x
hardwell vote top djs,SallySan_x
nb ssan instagram,SallySan_x
nb sweet adorable,SallySan_x
nb kidding working,SallySan_x
bottom feet hurts,SallySan_x
digidreamsfest fun giveaway gutted,SallySan_x
digidreamsfest app suppose notifications,SallySan_x
nb learn best slut,SallySan_x
orange black better good netflix comedy,SallySan_x
nb stupid uneducated people,SallySan_x
learn contour face slimmer,SallySan_x
mccoys years mccoys,SallySan_x
nb good books recommend,SallySan_x
nb yeah true remember people married young age,SallySan_x
nb face fail complain,SallySan_x
nb british sense humour,SallySan_x
nb skype tomorrow uk time,SallySan_x
nb yeah disrespectful hard send quick text msg guys suppose meet,SallySan_x
nb whimp steel lol,SallySan_x
nb yeah understand sense humour,SallySan_x
stay bed hot sunny,SallySan_x
mcdonalds vanilla iced coffee taste good,SallySan_x
nb good xx,SallySan_x
work long weekend,SallySan_x
nb hope offer,SallySan_x
nb will hate,SallySan_x
nb love iphone,SallySan_x
nb arrived safely,SallySan_x
coming toronto laidbackluke,SallySan_x
nb good updated,SallySan_x
going digital dreams veld,SallySan_x
spring today winter tomorrow bipolarweather toronto,SallySan_x
chatimeuk omg find chatime uk taro milk tea today store toronto,SallySan_x
nb serious apply mum lost birth certificate,SallySan_x
hate hate hate sick,SallySan_x
nb will forward snaccckkksss,SallySan_x
nb exciting hard sleepover,SallySan_x
urban decay naked palette fragile nooner cracked drop,SallySan_x
eatmandarin will valentines day,SallySan_x
nb argue stupid things things worth arguing,SallySan_x
torontoi piss working,SallySan_x
best night martingarrix absolutely smashed night uniun hope will summer festivals,SallySan_x
walking dead season netflixca,SallySan_x
best deal shoppers dior mascara set win,SallySan_x
nb to zealand september months save,SallySan_x
pinkystoronto explains work north building will pop south building tomorrow,SallySan_x
love app frmheadtotoe,SallySan_x
nb miracle post hrs ago netflix defiantly life,SallySan_x
started day slamming dishwasher door finger work defiantly great start,SallySan_x
armin van buuren will playing metro convention centre basement top floor ehh,SallySan_x
jeez cut carbs start diet,SallySan_x
netflixca amazing needed,SallySan_x
today day stuff face unhealthy food tomorrow will start healthy diet resolutions healthy,SallySan_x
work quiet today huge surprise,SallySan_x
theguvernment trip guv,SallySan_x
nb happy year,SallySan_x
jessicasanx photo sausage hasbrown casserole lol,SallySan_x
nb celebrate christmas happy holidays,SallySan_x
nb hmm lol independent bit,SallySan_x
nb serious depends money,SallySan_x
dress saturday night,SallySan_x
you hate job lazy bed ready,SallySan_x
stomach small full mini pizzas,SallySan_x
asosheretohelp asos restock items,SallySan_x
nb anemic blood cells normal,SallySan_x
love sister jessicasanx,SallySan_x
devastated dress wanted stock asos,SallySan_x
nb will private message proper conversation xxx,SallySan_x
nb surprises kids girl extremely rude nasty,SallySan_x
nb told sister teaching kids reply hahaha funny surprised,SallySan_x
nb hopefully find,SallySan_x
jeremitsme comment allezvous,SallySan_x
working weekends mad hate job,SallySan_x
yyifans remember big promised jess mini big better,SallySan_x
happy spooky halloween,SallySan_x
nasima told messaged,SallySan_x
nasima pizza today lunch eat lot salad day,SallySan_x
bit shopping therapy dufferin mall grocery shopping walmart,SallySan_x
yyifans nooooo years will anythin bring life lol goin to computer shop,SallySan_x
nasima start keeping track hours,SallySan_x
nasima second time underpaid fact payment will screwed,SallySan_x
nasima omg bad hazard drivers pedestrians,SallySan_x
poor poor poor laptop,SallySan_x
spent hour digging winter clothes packing summer clothes goodbyesummer,SallySan_x
bed shower waste day bed,SallySan_x
nasima nasima times amount times brush things ridiculous,SallySan_x
god extra day submit grades ryerson,shawnaoh_
early dismissal tomorrow,shawnaoh_
eat eat wear wear wanna,shawnaoh_
rip retail workers today,shawnaoh_
megan foster booking third tomorrow u worry,shawnaoh_
hurry winter break,shawnaoh_
megan foster cool tho,shawnaoh_
supposed pass bio fun,shawnaoh_
thought grade hard,shawnaoh_
eating spring rolls bath life better,shawnaoh_
hey buy vance joy tickets birthday,shawnaoh_
twerkling times changed,shawnaoh_
blessed live life live,shawnaoh_
wantneed cycles antm netflix,shawnaoh_
hollyovington best fun time drunk pass,shawnaoh_
quiet soft voices,shawnaoh_
love nasal infections fucking love,shawnaoh_
rileyperri fuck riley time,shawnaoh_
hate hate hate hate physics,shawnaoh_
megan trainor vancouver tickets,shawnaoh_
telus wifi worst things,shawnaoh_
twerkling sarajangster sara literally boat,shawnaoh_
joanneoh grounded provincials,shawnaoh_
disneyland tanner killing,shawnaoh_
jayleenaustria twitter dp omg love,shawnaoh_
twerkling laugh fucking choke,shawnaoh_
feeling chemistry mark lol,shawnaoh_
tanner jieun sleeping sitting table drinking water,shawnaoh_
anna jieun intoxicated,shawnaoh_
luv stanley park,shawnaoh_
allybrinn talk shit hit,shawnaoh_
megan foster loveyy gr,shawnaoh_
twerkling love lots fucking ugly,shawnaoh_
hate olive deleting,shawnaoh_
oliviashannnon literally drake,shawnaoh_
boys wearing shorter shorts,shawnaoh_
oliviashannnon eat shit,shawnaoh_
year today fml,shawnaoh_
kaileyyyyyyyy slutty whore,shawnaoh_
kimberlyyfaye kianlawley lov hard,shawnaoh_
wanna watch gossip girl season orange black,shawnaoh_
replace people puppies,shawnaoh_
blair waldorfs bitchy asian sidekick,shawnaoh_
weekend watch care,shawnaoh_
twerkling kimberlyyfaye lol tanner,shawnaoh_
wanna slight infection nasal passages hot,shawnaoh_
kaileyhbu sending card year will fuckin arrive,shawnaoh_
jaeinjeong defence states,shawnaoh_
happy valentines day,shawnaoh_
science provincial tomorrow,shawnaoh_
god semester break starts days,shawnaoh_
jaeinjeong wrong context,shawnaoh_
thelifeofalicia frying banana bread buy social life,shawnaoh_
guys peed year,shawnaoh_
merry christmas slaves,shawnaoh_
money buy cute christmas things room,shawnaoh_
zoey netflix understand,shawnaoh_
guys worst fucking wifi sos live,shawnaoh_
nightowl hope add seattlebellingham bc,shawnaoh_
hombosexuals pain thought,shawnaoh_
life basically annaastren,shawnaoh_
vancoiver sos live,shawnaoh_
jamalabc floral crocs,shawnaoh_
rileyperri bring louis harry harry,shawnaoh_
totally bombed test shawna,shawnaoh_
touches bc free country,shawnaoh_
science tests exist,shawnaoh_
making realize love electricity,shawnaoh_
maciverjenna forgot china lily,shawnaoh_
michael sos feel,shawnaoh_
falling love american horror story,shawnaoh_
heaven place earth,shawnaoh_
kaileyhbu happy free confused lonely time,shawnaoh_
hombosexuals acne day ahahaa,shawnaoh_
xmatthx matt tweeted ahhhhhh,shawnaoh_
sarajangster bring babe,shawnaoh_
montsedeveras sinigan love,shawnaoh_
joanneoh going doubt will bc naked shower,shawnaoh_
suck webcam pictures pls rid packaging,shawnaoh_
pay attention class,shawnaoh_
hola playlistlive chasegoehring perform hm hell rock socks chasegoehringtoplaylist,shawnaoh_
hollaclare holla baby,shawnaoh_
wow school spirit blk red,shawnaoh_
free pink dreamcatcher belly button ring lol,shawnaoh_
sosassbutt follow bc yolo sos live,shawnaoh_
kaileyhbu ya coming vancouver check,shawnaoh_
tbh grade going worse,shawnaoh_
will follow hey sos,shawnaoh_
yup life officially sucks,shawnaoh_
bc love lots breakingthelaw,shawnaoh_
ashton sos ashton birthday holla,shawnaoh_
kristinnitara ya birthday sushi lunch downtown,shawnaoh_
hours minutes birthday what,shawnaoh_
resolution sex bc will pregnant sink will leak toilet will clog going cry,shawnaoh_
songs repeat omg sos,shawnaoh_
sarajangster girl aint,shawnaoh_
hombosexuals rock star,shawnaoh_
word fuck regular word,shawnaoh_
wtf kids bus going downtown,shawnaoh_
sarajangster anus begs differ,shawnaoh_
sarajangster fuck favoriting phone vibrating dildo,shawnaoh_
literally traffic worst bus traffic worstest,shawnaoh_
hell kodaline coming vancouver,shawnaoh_
curtisyourwords voice inside headddd,shawnaoh_
guys homework playing fake eyelashes,shawnaoh_
feels good aquarium tbh,shawnaoh_
fuck channing tatum gorgeous,shawnaoh_
love shawna chaseyourwords live,shawnaoh_
holy shit masterchef fucking intense rn shitting,shawnaoh_
guys bed sos live,shawnaoh_
watching losers yell eachother inthetubwith sos sos live,shawnaoh_
online dickheads sos live,shawnaoh_
hashtag pray jenettes vagina,shawnaoh_
follow jamesyourwords cares,shawnaoh_
jamesyourwords hope today,shawnaoh_
guys follow twitter love chrisyourwords live,shawnaoh_
ashton sos pay attention science class ya follow,shawnaoh_
closing windows thunderstorm bc feel underwater submarine,shawnaoh_
amieisfierce started today tbh bc tumblr listened holy fuck good,shawnaoh_
michael sos calum sos luke sos likes bran ladies years,shawnaoh_
gno goooo omg,shawnaoh_
haileymkrag aw hailey dp aw honoured,shawnaoh_
jenna oldest people fucking theatre haahahhahaha,shawnaoh_
michael sos thought oops,shawnaoh_
god jsut ugh dylan,shawnaoh_
honey boo boos family tbh,shawnaoh_
calum sos waiting long day wow,shawnaoh_
jennamaciver ya suck dick,shawnaoh_
calum sos aw calum boy crushes aw,shawnaoh_
jakeseed wildest dreamsssss,shawnaoh_
worse translink skytrains,shawnaoh_
michael sos ashtons butthole,shawnaoh_
calum sos hoodrat calum hoodrat ha ha ha,shawnaoh_
hombosexuals nick omfg shshsh,shawnaoh_
hombosexuals calums butt,shawnaoh_
fml science weirdddddddd,shawnaoh_
casandralyons pretty face,shawnaoh_
twitter archive worst decision life omg grade dark year,shawnaoh_
cried screen offline tbh sos,shawnaoh_
michael kiss calum ashton cheek bc lazy kiss luke sosanswerme,shawnaoh_
luke wearing sunglasses inside sosanswerme,shawnaoh_
calum mighty fine sos live,shawnaoh_
luke sos love,shawnaoh_
rogers arena cab waved omg calum sos,shawnaoh_
kaileyhbu la la la la la la la la la la ife,shawnaoh_
pinterest addicting wtf,shawnaoh_
nightowl crying bc,shawnaoh_
calum sos making life eternity noticing sound,shawnaoh_
nightowl ya good week absolutely stay bed day,shawnaoh_
michael sos bed michael,shawnaoh_
amandaayall sounds gr better great ha,shawnaoh_
hombosexuals japadog sex,shawnaoh_
sos will bby,shawnaoh_
ashton sos ilysm,shawnaoh_
days pure leisure jennamaciver,shawnaoh_
ashton sos ha ha ha ha ha funny ashton,shawnaoh_
jennamaciver ice cream cake,shawnaoh_
luke sos omg,shawnaoh_
luke sos eggs,shawnaoh_
ashton sos tacos,shawnaoh_
baconiam aw nice bby,shawnaoh_
hollaclare watch dad will hell fun entire thing,shawnaoh_
baconiam lucky shit god,shawnaoh_
holy shit breaking amish going ruin,shawnaoh_
wow jennifer lawrence,shawnaoh_
hombosexuals hahahhahahhahahhaha beautiful best friend aw cute aw love,shawnaoh_
justin bieber chest hair laugh,shawnaoh_
calum sos naked,shawnaoh_
haileymkrag life ruined,shawnaoh_
doubledazzle hate ugly,shawnaoh_
calum sos rly,shawnaoh_
nightowl luke luke omg,shawnaoh_
hombosexuals sound miguel,shawnaoh_
jennamaciver dying bc faggot,shawnaoh_
calum sos vancouver,shawnaoh_
signing hot yoga worstbest decision life,shawnaoh_
goodnight whispered post concert depression remember concert sos shirt,shawnaoh_
basically arena oclock stood ledge concert luke niall zayn louis liam calum life,shawnaoh_
waited year months concert full permission carrot,shawnaoh_
ya head vancouver faster pls onedirection sos,shawnaoh_
wait oops meant,shawnaoh_
calum sos love meeeeeeee,shawnaoh_
kaileyhbu going laugh hard posts vancouver,shawnaoh_
rly dolphins teeth shaped,shawnaoh_
michael sos follow spree bc,shawnaoh_
sos follow buy food sosfamilyfollowspree,shawnaoh_
jaeinjeong god yayayyyyyy sunday yay aw,shawnaoh_
poop touching insides,shawnaoh_
rly pee rly move life,shawnaoh_
annaastren yay swag yolo,shawnaoh_
hollaclare clare love,shawnaoh_
realliampayne help follow spreefollowing,shawnaoh_
single choice choice,shawnaoh_
realliampayne best song wtf omg crying help sweet jesus,shawnaoh_
medication helps esteem help,shawnaoh_
bed bath semester,shawnaoh_
shakespeare hope die,shawnaoh_
lying harry styles dirty things,shawnaoh_
danielle fucking peazer answered askfm question sobbing bc life hear sobbing bc,shawnaoh_
nights rest paradise,shawnaoh_
niallonnylon jakeseed whores,shawnaoh_
niallonnylon uh yahhhh bby,shawnaoh_
bachadam english butthole tight,shawnaoh_
fuck read someones diary hidden reason read,shawnaoh_
glee omfg thetearsarereal,shawnaoh_
maciverjenna thought odyssey written shakespeare,shawnaoh_
bachadam fine fineliner,shawnaoh_
niallonnylon exactly win ha xo,shawnaoh_
ew today sucked bad,shawnaoh_
kmichaela jaeinjeong yayz,shawnaoh_
kmichaela best whore,shawnaoh_
niallonnylon samess bby,shawnaoh_
guys kissing single painfully aware,shawnaoh_
jittery tumblr start working omfg,shawnaoh_
jakeseed wow ily,shawnaoh_
themainsqueeze wow love lemonade best,shawnaoh_
niallonnylon tumblr filipino loser,shawnaoh_
harry styles attractive holla,shawnaoh_
doubledazzle taylor swift,shawnaoh_
hello beautiful starbucks,shawnaoh_
danniprasad jennamaciver sexless approached,shawnaoh_
jesus ciara beautiful video,Simon_Pella
love michelle obama,Simon_Pella
watch youthvideo troyesivan,Simon_Pella
simonpella stupid time,Simon_Pella
thomaskillip simply sound good,Simon_Pella
jeeyuntv recognized room awesome job,Simon_Pella
history teacher bae,Simon_Pella
idris oscarnoms beasts nation killed movie,Simon_Pella
feeling cloud happiness,Simon_Pella
hotlineting literally life,Simon_Pella
oliver jeweller absolute,Simon_Pella
changed profile picture french flag feel reassures victims families people forgotten,Simon_Pella
wtf people sikh poor guy,Simon_Pella
danjaapapajani thepussyasylum alex forgive,Simon_Pella
kids coming door costumes eyes halloween cute tho,Simon_Pella
teacher talks slow class feel longer,Simon_Pella
revival pretty good,Simon_Pella
ydkm donald trump american,Simon_Pella
tired hearing shootings hard pass guncontrol uccshooting,Simon_Pella
wait watch love priyankachopra,Simon_Pella
norm good point,Simon_Pella
ydkm vrxox ixnpurpose shawtytofresh sounds vrxox,Simon_Pella
shazam bullsht talkin destorm power kingkeraun,Simon_Pella
event recap vmas nowwatching,Simon_Pella
ydkm good facetime tonight,Simon_Pella
driving driving crazy wild,Simon_Pella
ydkm hey shu,Simon_Pella
vine dank memes,Simon_Pella
feeling darkness inspired imjakepaul lance vine lance,Simon_Pella
adampisarek wake early best weather dark reflects feeling,Simon_Pella
canadian grandma maple leaf socks vine andrewaubry,Simon_Pella
nickiminaj backtogether video fun idea robin,Simon_Pella
ydkm travis scott,Simon_Pella
scott dani days weeks,Simon_Pella
nickiminaj learned lyrics faster nicki song verse flawlessremix,Simon_Pella
police learn weapon and,Simon_Pella
nickiminaj making trip toronto anytimetomorrow,Simon_Pella
tired terrible attitude,Simon_Pella
viner macys shoe department vine kindasarahx,Simon_Pella
twitter beef helping,Simon_Pella
dude tryin waste big today vine stephangray,Simon_Pella
janko family vine georgejanko,Simon_Pella
srxo ya song,Simon_Pella
cuz remake vine justtylert,Simon_Pella
nickiminaj meekmill toooo,Simon_Pella
bout die hungry af vine michaelwashh,Simon_Pella
tenis vine queridoantonio,Simon_Pella
dads mustache creeps vine dannygoonzalez,Simon_Pella
side chick overstep boundaries elisa nadiya vine ichvse,Simon_Pella
vrxox nickiminaj grade,Simon_Pella
women slammed ground drunk guy beat doctor lab coat,Simon_Pella
somalians beautiful omg,Simon_Pella
best friend find combined srxo,Simon_Pella
yohaaam vine vine rkiye,Simon_Pella
nickiminaj guys honestly stopped dead feelingmyselfvideoontidal,Simon_Pella
srxo rude af,Simon_Pella
bitchy girl huge rush going vine hannah pilkes,Simon_Pella
friend vine benleviross,Simon_Pella
killed vine guysnolives,Simon_Pella
girl slaps man warantzatime vine anwarwj,Simon_Pella
dead nickleback vine reneelyon,Simon_Pella
famousclassy happy birthday,Simon_Pella
watched intervention sandi sober months reunited daughter jumped cheered lol gosandi,Simon_Pella
worry thingsage adaline feeling feels,Simon_Pella
punjabi man terrible therapist suicidal thoughts vine jusreign,Simon_Pella
aye dis meghantrainor,Simon_Pella
nap time best time dream,Simon_Pella
meghantrainor tonight toronto,Simon_Pella
srxo chem bio,Simon_Pella
nicki minaj day convo phone nickiminaj,Simon_Pella
swain carrying gold,Simon_Pella
srxo wtf shu,Simon_Pella
teenage girl twitter,Simon_Pella
nickiminaj stink surprise roman verse,Simon_Pella
nickiminaj kiss face missing roman verse,Simon_Pella
thepinkprint amazing good job nickiminaj songs lied gp,Simon_Pella
sherway lost seersears find yorkdale better beca seer gabgap nice thing nonna,Simon_Pella
shanghai math student hood fast lol nickiminaj thepinkprintonitunes,Simon_Pella
congrats nickiminaj deserve number spot thepinkprint,Simon_Pella
fire school alarm evacuated smoke halls cheap ass school,Simon_Pella
girl follow feel weird vine,Simon_Pella
coming canada nickiminaj heat cold,Simon_Pella
americanhorrorstory ahsfx lanadelrey gods monsters,Simon_Pella
person song max jr vine,Simon_Pella
breaking news ebola feeling wmax jr vineapp,Simon_Pella
katieqlowes lol scandai,Simon_Pella
person letshangout vineapp,Simon_Pella
rosalina jaymundo chris jessicavanessa vineapp,Simon_Pella
weaker goat vineapp,Simon_Pella
iphone phone homegirls sitting lookin bosos tripping hoes realest fo realest rap,Simon_Pella
parents relate dad pic mom hashbrown cool hashbrownselfie,Simon_Pella
dontyoujustlove parents snake plans,Simon_Pella
nickiminaj catchiest song heard,Simon_Pella
srxo dvd kraft dinner,Simon_Pella
people pictures cars belong vineapp,Simon_Pella
coffees time effin,Simon_Pella
happy birthday bud,Simon_Pella
park good place play ruben,Simon_Pella
shogunmifune lol long laughed good,Simon_Pella
days ago selfie rip grandpa,Simon_Pella
nickiminaj jeeesuz beautiful song onrepeat pillsnpotions,Simon_Pella
people mins facebookspringcleaning,Simon_Pella
thekaitlynmini buongourno bella,Simon_Pella
famous oscar winning redviolin,Simon_Pella
kerrywashington kidding scandalfinale,Simon_Pella
yelling teacher shushawnaa,Simon_Pella
favourite film time,Simon_Pella
tbt better days,Simon_Pella
canada beat usa sochi,Simon_Pella
blue ivy drink grammyhoney year newest,Simon_Pella
going feelinglike usainbolt,Simon_Pella
nickiminaj mom family alike lucky xd,Simon_Pella
school dance whao,Simon_Pella
developed improved laugh yesterday,Simon_Pella
bus empty firsttimeforeverything,Simon_Pella
lip gloss poppin,Simon_Pella
wowa terrorist attack mall nairobi,Simon_Pella
raplikelilwayne pussy pussy pussyyeahthats aint awussy wussy wussy,Simon_Pella
ladygaga reminds grade,Simon_Pella
shushawnaa find job,Simon_Pella
hindi beautiful language love bollywood priyankachopra,Simon_Pella
nickiminaj verse richfriday verses love pace,Simon_Pella
outlet mall shirt,Simon_Pella
dad play risk takes week play,Simon_Pella
great job bottle nickiminaj,Simon_Pella
waste lot time,Simon_Pella
simonasantagato um answer,Simon_Pella
juliaaabursa mi favorito amiga arriiiiba arriiiiba,Simon_Pella
deaf camp lilysumms tomorrow,Simon_Pella
happy canada day,Simon_Pella
horses backflips whew funny,Simon_Pella
nickiminaj wait twerk,Simon_Pella
thepurge awesome lilysumms,Simon_Pella
jesus amadeus grimm hell,Simon_Pella
heart broken impossible scottishversion,Simon_Pella
iisuperwomanii ellen lol,Simon_Pella
people helping ifeelloved,Simon_Pella
nickiminaj ciara love,Simon_Pella
baby sitting life,Simon_Pella
shut grandma jokinggrandma bash face,Simon_Pella
read head studder,Simon_Pella
thepussyasylum tomorrow film,Simon_Pella
elastics eat live,Simon_Pella
tasiasword damn amazing heaven,Simon_Pella
prayforboston people shit killing,Simon_Pella
funniest thing amazing job esa drama,Simon_Pella
thepussyasylum check facebook,Simon_Pella
reading book english minute,Simon_Pella
mentionsomeoneimportanttoyou shushawnaa thepussyasylum die,Simon_Pella
jordankmills love dimples,Simon_Pella
justinbieber instagram nickiminaj,Simon_Pella
pillows lil wayne,Simon_Pella
rob ford worst public speaker heard topoli,Simon_Pella
best moment slips falls front,Simon_Pella
hate english hate poems hate expressing,Simon_Pella
caught illegal footage crown jewels delete fml,Simon_Pella
bitches stole seats,Simon_Pella
harlem shake laugh hard,Simon_Pella
grammys rihanna amazing hair,Simon_Pella
jinx owe sofa shushawnaa,Simon_Pella
selmaalameri kidding holy chose ttiertierra good worry ugh,Simon_Pella
shovelled neighbours driveway feel star,Simon_Pella
question nasty hope reference,Simon_Pella
nominate iisuperwomenii shorty award videoblogger funny shit,Simon_Pella
uberfacts feet spider nehasati,Simon_Pella
ready min mrsfairclough,Simon_Pella
adampisarek dat waz,Simon_Pella
supporting kids cancer inside ride,Simon_Pella
beyonce video spree,Simon_Pella
shushawnaa life fuck kim,Simon_Pella
replacesongtitleswithvagina nicki minaj pound vagina,Simon_Pella
thehobbit amazing good lotr amazing,Simon_Pella
finally stage braces today,Simon_Pella
stealing golfwanghoe jokes muahahaha,Simon_Pella
nehasati simonpella interaction gelatinous nehasati,Simon_Pella
teachers min studying subject night min snack breakwe opposite,Simon_Pella
evacuate building public service announcement evac nickiminaj bitch shut fck lmfao,Simon_Pella
golfwanghoe lol daniel scott fucking hide phone hour hour telling dumb,Simon_Pella
people profile serious wtf,Simon_Pella
kendall jenner runway vogue paris vogueparis,styleofthesix
speakcomedy bc hate babbarsahil,tanya_babbar
