Tweets,Follower
nanogeekette incredibly jealous hungrywritersarenotfun nanowrimo,RowanMMolloy
minutes gotime nanowrimo atleast,RowanMMolloy
ericnentrup today tomorrow nanowrimo,RowanMMolloy
official goal hit friday day early busy times day total nanowrimo writinglikecrazy,RowanMMolloy
frinightwrites minutes writeclub,RowanMMolloy
going head night full day work tomorrow better write good material tomorrow write garbage today,RowanMMolloy
officially novel wattpad today nanowrimo,RowanMMolloy
written today dnanowrimo gettingbackontrack,RowanMMolloy
break yay nanowrimo,RowanMMolloy
becomingcliche pie nomnomnomnom,RowanMMolloy
officially nanowrimo today ton planning onlytimeshalltell writinglikecrazy,RowanMMolloy
coreyvidal bufferfestival headed canadian eh daily vloggers,RowanMMolloy
nanowordsprints thought clouds introduce favourite minor character outline,RowanMMolloy
heyimissie tsbnick nickabella,RowanMMolloy
nanowordsprints serenalawless wc nanowrimo,RowanMMolloy
corradocoia change preferences bufferfestival orders will best,RowanMMolloy
happy birthday corradocoia,RowanMMolloy
tsbnick books cool things,RowanMMolloy
mackavaldez tsbnick nope,RowanMMolloy
hoping speck dust picks speed drop conflicted,RowanMMolloy
alextwestlake heyimissie people fun,RowanMMolloy
heyimissie tsbnick shipitlikefedex,RowanMMolloy
excited ukulele duets heyimissie thiswillbefun tsbnickyear,RowanMMolloy
wheezywaiter write tv,RowanMMolloy
alextwestlake absolutely terrible harry potter puns tsbnickyear,RowanMMolloy
corradocoia guessing older help,RowanMMolloy
sir sir service sir favourite inthiswillbeagreatbook,RowanMMolloy
novel validated guess breather nowcampnanowrimo,RowanMMolloy
will win tonight will win tonight ktogo kgoal campnanowrimo determined,RowanMMolloy
word percentdone sohappy knight campnanowrimo campnano excited,RowanMMolloy
annoys friends guy people thinking dating great talk love alex haveaboyfriend,RowanMMolloy
iron man movies day stan lee cameo stark steal moustache rdj ironman summer,RowanMMolloy
you good person occasionally,RowanMMolloy
realjohngreen hit fans,RowanMMolloy
woo hoo voted win mybbb destinations ultimate rtw trip cash,RowanMMolloy
corradocoia sucks thing fridge house post office,RowanMMolloy
nanowordsprints works find word works moment stays,RowanMMolloy
corradocoia happy birthday card will house week slow mail slow fun halloween haunt,RowanMMolloy
corradocoia stickynoteanswers wrong turn,RowanMMolloy
mrrpmurphy twitter literally favorite thing,RowanMMolloy
magical glorious story tyleroakley met chriscolfer,RowanMMolloy
coreyvidal tomorrows gathering official,RowanMMolloy
samanthafall po box,RowanMMolloy
hankgreen watching scishow video science class,RowanMMolloy
congratulations ryerson alumni catmackinnon actranat woman year,RyersonU
tapping perspectives solve community rbc immigrant diversity inclusion event,RyersonU
whyryerson openhouse day,RyersonU
tonight perfect night cityhall selfie lights blue gold ryersonrams love werrams,RyersonU
beat procrastination study night long rslc tonight study blitz full schedule events,RyersonU
ayymolina study time,RyersonU
considering ryerson students sharing influenced,RyersonU
community transformation cafe series tomorrow social innovation,RyersonU
feel receive feedback writing ryerson students,RyersonU
nights win lancers rams hoping bring oua banner fans werrams cis,RyersonU
takes village resettle family students staff faculty lifelinesyriaru,RyersonU
swing trsmryersonu today free legal advise clinic,RyersonU
engineering students will push vw beetle campus hours starting thursday help raise money sickkids,RyersonU
congratulate viola desmond award recipients evening ryersonedi,RyersonU
ryerson interim president mohamed lachemi speaks viola desmond award ceremony,RyersonU
mushtabaholwayy time charged exams energy,RyersonU
touch dial ryerson internet radio station will airwaves cjru march st,RyersonU
artmblake happening day today mattamyac,RyersonU
floor rslc special dedication sarabjit marwah learning exchange,RyersonU
diversity matters ryersonreview dissects complicated diversity canadians understand,RyersonU
congrats krystenconnely thesaad jesse berger winning theeconomist real vision investment case study competition,RyersonU
gretmoll schedule winter exams will posted march,RyersonU
chance check air tonight led installation aimed raise awareness homelessness,RyersonU
multivursqueen anticipate service disruptions pm classes continue monitor updates posted,RyersonU
kerriandreas open tonight checking twitter changes,RyersonU
capture beauty snowy campus enter chance feature photo ryersonalumni post card,RyersonU
ryersoncue kirstyduncanmp announced federal funding including dr bala venkatesh work nserc,RyersonU
ximadreamer question find ticket price breakdown,RyersonU
renowned filmmaker atom egoyan joins tiffnet ryerson mindandaction panel tues mar,RyersonU
learn jonathon anderson approaches technology incorporates innovation interiordesign,RyersonU
myriiiammm definitely to interrupt study process experiencing wifi disruption ryersonfixit,RyersonU
camjamesmr services team happened,RyersonU
find eggythemascot rslc celebrating rslcyr students,RyersonU
dianekashin future engineers building,RyersonU
ryerson open classes running scheduled monitoring weather expect disruptions rest day,RyersonU
rachcosta monitoring weather closely changes schedules will appear front,RyersonU
partnering tangerinebank launch thinkubator will drive innovation fintech,RyersonU
itsjohninnit monitoring weather situation day checkin updates,RyersonU
create safe efficient healthy transportation options join panel discussion thursday,RyersonU
board governors senate election campaigns candidate,RyersonU
rslc turns share favourite place study relax classes hashtag rslcyr wait hear,RyersonU
build skills change weekend day program campus oliviachow visit,RyersonU
attend akua benjamin legacy project lecture tonight tune live stream starts,RyersonU
sarahsalutesyou campus photos scenic locations,RyersonU
winter capture beauty campus photo featured ryersonalumni calendar,RyersonU
uberlearn great photo forget enter ryersonalumni photo contest,RyersonU
james paul gee discusses learning games changschooltalks,RyersonU
build knowledge discussions justice walks social media workshops jack layton leadership school,RyersonU
learn ryersonsafety helps faculty staff students sustain safe secure environment,RyersonU
hey ryerson students chance win starbucks gift card thoughts rslc,RyersonU
business basketball panel special guest nba hall famer wayne embry start eng,RyersonU
dmzsession started tune,RyersonU
tonights ryersonrams hockey game snap pic norm help raise funds orphans ru osp,RyersonU
congratulations ekuzheleva big win,RyersonU
ryerson marketing professors weigh sb ads torontostar,RyersonU
yungbabyqirl send direct message details contacted ryerson,RyersonU
earlier today jennvalentyne stopped learning support center hope caught live bttoronto,RyersonU
eggy will rslc tomorrow morning making appearance bttoronto join start week tv,RyersonU
video series aboriginal role models inspires future learners attend university futurefurther cdnpse,RyersonU
usetherightwords join discussion reporting sexual violence feb,RyersonU
policy studies phd candidate bridges generations groundbreaking indigenous governance learn,RyersonU
colin robert phillips traditional phd student read remarkable story ryerson onpse students,RyersonU
matter long work account prepared flood ned ryerson content february bing,RyersonU
sisters ramily great video ryerson womens basketball players keneca siki ryersonrams werrams,RyersonU
amazing student nominate dennis mock student leadership award feb,RyersonU
ryerson faculty members interview topics edaw onpse,RyersonU
bonnie patterson appointed distinguished visiting professor trsmryersonu,RyersonU
healthy safe wonderful weekend ryerson tweet monday,RyersonU
find to job career compass ryersonu career job search guide,RyersonU
learn pros cons journalism experts debate neutrality journalism ryersonrjrc feb,RyersonU
great opportunity work coming artists edition photobook starts today,RyersonU
tips ryerson best practices enhance privacy protection honour data privacy day jan,RyersonU
mental wellbeing friendly reminder takecareru bellletstalk,RyersonU
ceremonial ribbon cutting ibest biomedical zone stmikeshospital biomedicalzone ryscidean rezamoridi,RyersonU
filmmaker marketing executive barry avrich appointed distinguished visiting professor ryersonfcad,RyersonU
check ryerson student contributions room opening weekend gladstonehotel,RyersonU
interested ryerson governance attend session board senate elections feb noon jor,RyersonU
trsmryersonu grad charith perera scores investment dragons den auto parts ecommerce company,RyersonU
yee haw jan annual country night mac grab hat mens hockey team brock free onecard,RyersonU
international issues discussion iid series hosts child soldier conversation michel chikwanine jan,RyersonU
aboriginal students finding respect healing opportunity difference social work program,RyersonU
attn students kick semester free hot lunch rlsc jan noon pm,RyersonU
grad students sign minute thesis competition jan showcase win cash prizes,RyersonU
ryersondas students years dascollab exploring human relationship water,RyersonU
mens womens ryersonrams basketball teams yorkulions wednesday,RyersonU
happy year university open today classes resume january,RyersonU
drop jorgenson lobby hot chocolate treats caroling santa tomorrow,RyersonU
confirm eligibility graduate officially graduated request letter ryerson,RyersonU
academic advisement report ramss monitor academic progress ryerson,RyersonU
chriscaluma internal phone,RyersonU
congrats rufeas professor seth dworkin young engineer award ospe peohq,RyersonU
difference holiday lifelinesyriaru volunteers donations syrianrefugees,RyersonU
missed ryersons hourofcode hosted ryscidean happened,RyersonU
join ryequity sanism stigma mental wellbeing talk dec pm pod ryersonedi,RyersonU
business leader stephen pumple appointed distinguished visiting professor ryersons rufeas,RyersonU
writing ryersonexams mtcc mins campus success,RyersonU
ryerson fashion comms student kelly ann nguyen true cost buying cheap clothes fastfashion,RyersonU
questions exam schedules locations bring answers ryersonexams,RyersonU
opinion matters public realm jan open house hear share ideas ryerson evolving campus,RyersonU
applied transfer credits review your transfer credit report ramss ryerson,RyersonU
checked brand refresh brand story story impact,RyersonU
confirm eligibility graduate officially graduated request letter ryerson,RyersonU
ryerson student kyjedward great piece macleansmag quest learn ancestral tongue ojibwe,RyersonU
hurrah ryersons goodbye president levy,RyersonU
curious steps receiving transfer credit visit steps ryerson,RyersonU
applied transfer credits review your transfer credit report ramss ryerson,RyersonU
tips exam season michelle green manager examinations special projects ryersonexams,RyersonU
tomorrow winter transfer credit deadline applied ryerson,RyersonU
join usetherightwords explore media coverage sexual violence dec,RyersonU
today sheldon levys final day president ryerson community toronto,RyersonU
academic advisement report ramss monitor academic progress ryerson,RyersonU
rsvp master professional communication info night december st ryerson,RyersonU
visit security ryersonrc illc lobby today tips safe ryersonexams,RyersonU
security will lobby slc today pm talking students personal safety exams visit,RyersonU
join share memories enjoy refreshments celebrate achievements president levy nov mac,RyersonU
rams player kristine yan battles injury ryersonrams ramily werrams,RyersonU
applications ricgallery photography fellowships close november photography blackstarcollection,RyersonU
good luck annu gaidhu ru student reigning india canada nominated ivhq volunteer year,RyersonU
curious st year join whyryerson chat pm hear students share experiencesadvice,RyersonU
kudelka meets ryerson dances performance original work renowned choreographer james kudelka,RyersonU
tonights night ryersondas hosts awards night student showcase paul cocker gallery pm,RyersonU
friday trans day remembrance join ryerson memorial noon rslc atrium,RyersonU
advised objects today animal organs student art project disposed victoria st,RyersonU
theatre school dance program staging original performance renowned canadian choreographer james kudelka,RyersonU
rsvp master professional communication info night dec ryerson,RyersonU
learn continuingeducation ryerson attend changschool open house nov,RyersonU
ryerson graduate maayanziv creates app leading welcoming accessible accessnowapp,RyersonU
licence access copyright expires dec learn commitment copyright compliance,RyersonU
prof myer siemiatycki transit will shape neighbourhoods ryerson torontostar,RyersonU
applied transfer credit required submit course outlines visit ryerson,RyersonU
december winter transfer credit deadline find apply ryerson,RyersonU
audition today pm ted rogers management conferences multicultural night march,RyersonU
attend evenings interactive lecture cathy crowe alex abramovich,RyersonU
prof frank russo brain body reacts music yahoohealth ryerson,RyersonU
chillin gould nov pm support united ruunited,RyersonU
icymi ryersondmz ranked st north america ubi global ranking ubiglobal startups entrepreneurship,RyersonU
december winter transfer credit deadline find apply ryerson,RyersonU
prof amatthewsdavid poisonous green pigments terrorized victorian fashion jezpictorial,RyersonU
hockey insider reporter alum bob mckenzie receives elmer ferguson memorial award hockey journalism,RyersonU
ramily cn tower stair climb support united nov ruunited,RyersonU
deantrsm talks globeandmail ryersonmbas ranking theeconomist ryerson,RyersonU
rams basketball teams opener varsityblues students faculty staff attend free onecard,RyersonU
ryerson host toronto charity homeless connect mattamyac sunday nov,RyersonU
taliaschlanger contributing wise,RyersonU
great weekend happy halloween forget turn clocks hour,RyersonU
grad students enter grad word second video contests win prizes totaling ryerson,RyersonU
brands forced stand issue quotes prof seung hwan lee yahoocanada,RyersonU
teen innovators frank andre heartwatch invent wearable heartmonitoring device biomedicalzone stmikeshospital,RyersonU
grab tickets ryerson theatre schools sixplay series suburban motel filthy rich,RyersonU
support cn tower stair climb united contributing ryerson rams fundraising goal ruunited,RyersonU
employee award nominations open nov nominate exceptional faculty staff member ryersonhr,RyersonU
canadian british election polls donald trump piece prof dktrdr washingtonpost,RyersonU
night astronaut chris hadfield will massey hall headlining sciencebased variety,RyersonU
rsvp tues info session ryerson professional masters diploma enterprise info privacy data protection,RyersonU
ryerson partners recommend strategies closing canadas bigdata talent gap,RyersonU
catch octobers sustainability matters newsletter online rsustainability,RyersonU
learn ryersons urban development master program rsvp oct open house,RyersonU
cur policy seminar oct ryersonfcs,RyersonU
cur policy seminar oct ryersonfcs,RyersonU
attend oct learn advances tech ryerson researchers students great discount,RyersonU
explore public cultural performance ryersonfcads performigrations exhibit oct,RyersonU
distinguished visiting professor stephen lewis speak alan whiteside hivaids controversies oct,RyersonU
help support community donation united ruunited,RyersonU
good morning ryerson happy election day exln,RyersonU
ryersons emergency awareness preparedness response procedures visit,RyersonU
rsvp learn ryersons urban development master program oct,RyersonU
employee award nominations open nominate exceptional faculty staff member today ryerson ryersonhr,RyersonU
hear lively thoughtprovoking ideas walrusmagazine talk oct trsmryersonu,RyersonU
check weegee murder business opens today ryerson image centre ricgallery,RyersonU
fall convocation today congratulations graduates roadfromryerson,RyersonU
grad students enter grad word second video contests win prizes totaling ryerson,RyersonU
happy tuesday ryerson wishing students study week wonderful break,RyersonU
changschool dean marieatryerson talks canadianliving adult education ryerson,RyersonU
ramily members starting thanksgiving long weekend early happy safe holiday remember ryerson will closed monday,RyersonU
mens hockey opener fri mattamyac onecard ticket ryersonrams games prizes,RyersonU
vote advanced polls drop ryerson student campus centre october,RyersonU
learn abt stick budget sign rudebtfree free financial literacy course students,RyersonU
ryersons trimentoring program turns year help raise days tmpturns,RyersonU
vote advanced polls ryerson student campus centre october,RyersonU
congrats arlene you ryeshomegrown ryerson,RyersonU
pillars ryerson student affairs mental eing,RyersonU
congratulations queensus arthur mcdonald winner nobelprize physics nobelprize cdnpse,RyersonU
thinking grad school rsvp oct yeates school graduate studies open house ryerson,RyersonU
drbenbarry surprisingly subversive mens loafer nytimes ryerson fashion,RyersonU
join oct gould victoria slc atrium raining learn united campaign ruunited,RyersonU
navneetr navneet metrolinx oversees app direct questions,RyersonU
goodbye shy ryersonpsych prof martin antony people develop shyness ryerson,RyersonU
ruservicehub find onestop shop student administrative,RyersonU
hmm familiar ramily,RyersonU
will donated trimentoring program tweet tmpturns tweeting ryerson,RyersonU
smlabtos polidashboard reveals people federal election cdnpoli elxn,RyersonU
grad student writing guru mark award recipient developed specialized graduate writing groups,RyersonU
dhps human rights services reflects dept advocacy fairness respect ryersonedi,RyersonU
socialmedia help hinder political debates prof gregelmer weighs cbcnews cdnpoli,RyersonU
happy tuesday forget vote favourite timberfever structure pm,RyersonU
paws furry friends rutherapydogs today lower gym khw pm,RyersonU
visiting ouf note dvp currently closed fall maintenance will reopen monday sept ryersonouf,RyersonU
future rams coming ouf don valley parkway will closed weekend plan ahead,RyersonU
attend soup substance blacklivesmatter equity social justice policing sept pod,RyersonU
latest news info campus coverage ryersontoday online email,RyersonU
plugndrives evdaytoronto underway ydsquare ryersoncue team,RyersonU
fashion industry injured women piece prof alison matthews david independent,RyersonU
attend soup substance blacklivesmatter equity social justice policing sept pod,RyersonU
happy yomkippur observing,RyersonU
prof chris macdonald companies making best employees miserable trsmryersonu cdnbiz,RyersonU
thinking grad school attend yeates school graduate studies open house oct ryerson,RyersonU
local candidates matter voters features prof daniel rubenson ottawacitizen cdnpoli,RyersonU
ryerson journalism student vanessafrancone scoop rbcs tiff red carpet correspondent,RyersonU
bustamyth ryscidean ryerson mythbustersto,RyersonU
director luis ospina talks work tiff premiere documentary started today,RyersonU
gritty underbelly manhattan weegees images display ricgallery oct,RyersonU
reminder ryerson will conducting fall fire drills legislative requirement buildings week,RyersonU
credit ratings budgeting planning life school learn personal finance skills rudebtfree,RyersonU
attend parttime job fair tomorrow pm gould st ryerson hireru,RyersonU
hadialramadan ryersonfcad admissions website follow whyryerson,RyersonU
learn personal financial concepts tools manage money better ryerson rudebtfree,RyersonU
congratulations prof marusya short listed cbc creative nonfiction literary award ryerson cbcbooks,RyersonU
krisnas reported earlier signs condoned ryersonu ryerson group,RyersonU
fyi ice cream,RyersonU
ahnansii offensive signs condoned ryersonu ryerson group report ryersonfixit,RyersonU
davidcommon ryerson security investigating matter info contact security securityryersonca,RyersonU
brinorris ryerson security investigating matter info contact security securityryersonca,RyersonU
joshharrower ryerson security investigating matter info contact security securityryersonca,RyersonU
angelajvink working remove offensive signs campus report location ryersonfixit,RyersonU
joshharrower working remove offensive signs oncampus report location ryersonfixit,RyersonU
happy anniversary toronto city hall npstoronto turned yesterday cityhall,RyersonU
ryersonu alumni weekend rediscover campus special tours ruaw,RyersonU
gingeeboi ryesu event questions directed,RyersonU
kgiles congratulations mindandaction social media contest winner email ryersoncgcegmailcom details,RyersonU
sign mosesstructures timberfever designbuild challenge deadline sept ryersondas,RyersonU
introducing courses schools faculties fall visit details ryerson,RyersonU
gogonchar ryesu send dm talk programs opportunities help,RyersonU
meet students starting lives ryerson fall rustudentlife roadtoryerson,RyersonU
will happen students mindandaction twitter instagram chance win rucampusstore,RyersonU
sharing norm mxxshah ryerson nothrowbackneeded,RyersonU
jacquelyncyr nice enjoy st day,RyersonU
enter win rucampusstore visit booth gould st share happen mindandaction,RyersonU
note farmers market location changed pitman quad today rueats,RyersonU
ratnaomi executive director gdxryerson discusses challenges refugees face coming canada nationalpost,RyersonU
changschool dean marieatryerson to school adult canadianliving,RyersonU
ratnaomi executive director gdxryerson quebec plans aid syrian refugees globeandmail syriancrisis,RyersonU
baldeep good morning great question ruservicehub,RyersonU
city long weekend check openstreetsto sunday pm ryerson,RyersonU
solutions life stressful situations quotes ryerson prof martin antony insidefitness,RyersonU
ready alumni weekend dj beer yummy food awesome giveaways ruaw,RyersonU
celebrate ryersons cultural diversity campus today ryersoniss,RyersonU
ryerson roadtoryerson guinnesschallenge,RyersonU
spanningthegaps bridges ryerson program powerful foundation student success,RyersonU
openstreetstos sept pm music workshops thercm activity hub bloorstculture,RyersonU
learn abt stick budget sign rudebtfree free financial literacy course students,RyersonU
happy day september ramily,RyersonU
congratulations president levy hell continue contribute strength entire post secondary system role,RyersonU
live tv students join corner gould victoria tomorrow bttoronto participants prizes giveaways,RyersonU
learn abt stick budget sign rudebtfree free financial literacy course students,RyersonU
order textbooks online sept chance win rucampusstore,RyersonU
ramspride alumni weekend ryersonrams york lions ruaw,RyersonU
excited rutherapydogs backs campus oweek roadtoryerson,RyersonU
contribute ryersons crossfaculty general interest publication follow ryersonfolio info updates,RyersonU
ideas ignite rsvp changschool continuinged open house aug ryerson,RyersonU
learn best barrierfree routes travel campus ryersonedi roadtoryerson,RyersonU
changschools conted open house aug learn oncampus online programs,RyersonU
khe khw will power pm aug will closed community ryerson,RyersonU
zrobichon good luck,RyersonU
cne starts today learn ryerson alum letsgototheexs general manager virginia ludy,RyersonU
don mythbustersto ryerson community members discount ontsciencectr sat,RyersonU
drbenbarry fall fashions blurred gender lines flarefashion ryerson fashion,RyersonU
arc eng building will power tomorrow pm will closed community ryerson,RyersonU
drop gould st farmers market pm grab lunch fresh ontario produce rueats farmersmktsont ryerson golocal,RyersonU
definition urban garden ryerson green roof helps toronto cool hot days today,RyersonU
men skirts drbenbarry fall fashions blurred gender lines flarefashion ryerson fashion,RyersonU
ryscidean weighs stem toys girls ryerson science,RyersonU
icymi southeast asian restaurant basil box will coming rslc winter ryerson,RyersonU
vic ced ima ric sbb will power tonight pm will closed community power will restored ryerson,RyersonU
trsmryersonu hosts aie ru conference august discuss building inclusive entrepreneurship ecosystem,RyersonU
city weekend check openstreetsto sunday pm ryerson,RyersonU
review list upcoming power disruptions closures ryerson campus ensure,RyersonU
happy farmers market day visit gould st pm great eats fresh produce rueats ryerson golocal,RyersonU
ryersonu resource centre open friday,SallySan_x
work ryersonslc level,SallySan_x
yall gotta follow desiperkins snapchat gotta watch fall butt youtuber myfave,SallySan_x
asklloydsbank called credit card team morning girl call helpful excellent service,SallySan_x
falling asleep class,SallySan_x
feet ice cubes,SallySan_x
lady quiet tonight stomping,SallySan_x
help win awesome giveaway dave lackie,SallySan_x
class tomorrow sad times,SallySan_x
tetsulineup hope queue,SallySan_x
tnluk love win help pay college tuition fees childhoodeducation millionaires,SallySan_x
school work motivation,SallySan_x
watching trainwreck will shit movie,SallySan_x
going toronto st,SallySan_x
everyday going feeling temporary life emotions feelings,SallySan_x
biggest decision month absolutely petrified,SallySan_x
colour wig ombre hairdressers blonde longhair,SallySan_x
royalmail tracking status showing item parcels rm days,SallySan_x
summer dior pink design eyes lips,SallySan_x
